,ID,ORF,SPOT_ID,Species.Scientific.Name,Annotation.Date,Sequence.Type,Sequence.Source,Target.Description,Representative.Public.ID,Gene.Title,Gene.Symbol,ENTREZ_GENE_ID,RefSeq.Transcript.ID,AGI,Gene.Ontology.Biological.Process,Gene.Ontology.Cellular.Component,Gene.Ontology.Molecular.Function,logFC,AveExpr,t,P.Value,adj.P.Val,B
1,245060_at,At2g39770,,Arabidopsis thaliana,Jun 9, 2011,Exemplar sequence,Affymetrix Proprietary Database,GDP-mannose  pyrophosphorylase updated per Conklin PL et al, PNAS 1999, 96(7):4198-203;supported by full-length cDNA: Ceres:37775.,At2g39770,CYT1 (CYTOKINESIS DEFECTIVE 1); mannose-1-phosphate guanylyltransferase/ nucleotidyltransferase,CYT1,818562,NM_129535,AT2G39770,0009058 // biosynthetic process // inferred from sequence or structural similarity /// 0009058 // biosynthetic process // inferred from electronic annotation /// 0009408 // response to heat // inferred from mutant phenotype /// 0009651 // response to salt stress // inferred from mutant phenotype /// 0009753 // response to jasmonic acid stimulus // inferred from expression pattern /// 0010193 // response to ozone // inferred from expression pattern /// 0019853 // L-ascorbic acid biosynthetic process // inferred from mutant phenotype /// 0030244 // cellulose biosynthetic process // inferred from mutant phenotype /// 0042742 // defense response to bacterium // inferred from mutant phenotype /// 0060359 // response to ammonium ion // inferred from mutant phenotype,,0004475 // mannose-1-phosphate guanylyltransferase activity // inferred from mutant phenotype /// 0004475 // mannose-1-phosphate guanylyltransferase activity // inferred from sequence or structural similarity /// 0016779 // nucleotidyltransferase activity // inferred from sequence or structural similarity /// 0016779 // nucleotidyltransferase activity // inferred from electronic annotation,1378.5,3963.95,44.8318077364139,3.52274520781227e-05,0.0117287095219816,-4.43588163968829
2,245249_at,At4g16760,,Arabidopsis thaliana,Jun 9, 2011,Exemplar sequence,Affymetrix Proprietary Database,acyl-CoA oxidase like protein ; supported by cDNA: gi_3044213_gb_AF057044.1_AF057044,At4g16760,ACX1 (ACYL-COA OXIDASE 1); acyl-CoA oxidase,ACX1,827381,NM_117778,AT4G16760,0001676 // long-chain fatty acid metabolic process // inferred from mutant phenotype /// 0002213 // defense response to insect // inferred from genetic interaction /// 0006629 // lipid metabolic process // inferred from electronic annotation /// 0006631 // fatty acid metabolic process // inferred from electronic annotation /// 0006635 // fatty acid beta-oxidation // inferred from direct assay /// 0006635 // fatty acid beta-oxidation // non-traceable author statement /// 0006635 // fatty acid beta-oxidation // inferred from electronic annotation /// 0008152 // metabolic process // inferred from electronic annotation /// 0009555 // pollen development // inferred from genetic interaction /// 0009611 // response to wounding // inferred from expression pattern /// 0009620 // response to fungus // inferred from expression pattern /// 0009695 // jasmonic acid biosynthetic process // inferred from mutant phenotype /// 0046686 // response to cadmium ion // inferred from expression pattern /// 0055114 // oxidation reduction // inferred from electronic annotation,0005777 // peroxisome // inferred from direct assay /// 0005777 // peroxisome // inferred from sequence or structural similarity /// 0005777 // peroxisome // inferred from electronic annotation,0003995 // acyl-CoA dehydrogenase activity // inferred from electronic annotation /// 0003997 // acyl-CoA oxidase activity // inferred from direct assay /// 0003997 // acyl-CoA oxidase activity // inferred from mutant phenotype /// 0003997 // acyl-CoA oxidase activity // inferred from sequence or structural similarity /// 0003997 // acyl-CoA oxidase activity // inferred from electronic annotation /// 0016491 // oxidoreductase activity // inferred from electronic annotation /// 0016627 // oxidoreductase activity, acting on the CH-CH group of donors // inferred from electronic annotation /// 0050660 // FAD or FADH2 binding // inferred from electronic annotation,-2364.4,15675.75,-22.5982587415736,0.000251129780742964,0.0216882868219672,-4.43682950215619
3,245266_at,At4g17070,,Arabidopsis thaliana,Jun 9, 2011,Exemplar sequence,Affymetrix Proprietary Database,hypothetical protein ; supported by cDNA: gi_15912320_gb_AY056438.1_,At4g17070,,,827415,NM_117811,AT4G17070,0006457 // protein folding // inferred from electronic annotation /// 0006979 // response to oxidative stress // inferred from mutant phenotype,,0003755 // peptidyl-prolyl cis-trans isomerase activity // inferred from electronic annotation /// 0016853 // isomerase activity // inferred from electronic annotation,-444.4,959.85,-14.3433471565066,0.00091880962713058,0.0386260059116758,-4.43868843326412
4,245273_at,At4g14950,,Arabidopsis thaliana,Jun 9, 2011,Exemplar sequence,Affymetrix Proprietary Database,hypothetical protein ; supported by cDNA: gi_16604570_gb_AY059730.1_,At4g14950,,,827153,NM_117581 /// NM_202822 /// NM_202823,AT4G14950,,0005783 // endoplasmic reticulum // inferred from direct assay,,372.75,765.825,54.7489231339631,1.98458158622472e-05,0.00910140406615869,-4.43577473867644
5,245882_at,At5g09470,,Arabidopsis thaliana,Jun 9, 2011,Exemplar sequence,Affymetrix Proprietary Database,mitochondrial carrier-like protein mitochondrial dicarboxylate carrier - Rattus norvegicus, EMBL:AJ223355,At5g09470,mitochondrial substrate carrier family protein,DIC3,830806,NM_120984,AT5G09470,0006810 // transport // inferred from sequence or structural similarity /// 0006810 // transport // inferred from electronic annotation /// 0006839 // mitochondrial transport // inferred from direct assay /// 0006839 // mitochondrial transport // inferred from sequence or structural similarity /// 0055085 // transmembrane transport // inferred from electronic annotation,0005743 // mitochondrial inner membrane // inferred from electronic annotation /// 0005743 // mitochondrial inner membrane // inferred from sequence or structural similarity /// 0016020 // membrane // inferred from electronic annotation /// 0016021 // integral to membrane // inferred from electronic annotation,0005310 // dicarboxylic acid transmembrane transporter activity // inferred from direct assay /// 0005488 // binding // inferred from sequence or structural similarity /// 0005488 // binding // inferred from electronic annotation /// 0017077 // oxidative phosphorylation uncoupler activity // inferred from sequence or structural similarity,-160.25,467.525,-13.8822738204289,0.00100820244882624,0.0400970541388966,-4.438896620391
6,245929_at,At5g24760,,Arabidopsis thaliana,Jun 9, 2011,Exemplar sequence,Affymetrix Proprietary Database,alcohol dehydrogenase - like protein alcohol dehydrogenase 6, Vitis vinifera, EMBL:AF195866;supported by full-length cDNA: Ceres:155666.,At5g24760,,,832545,NM_001085150 /// NM_122385 /// NM_203102,AT5G24760,0008152 // metabolic process // inferred from electronic annotation /// 0055114 // oxidation reduction // inferred from electronic annotation,0005737 // cytoplasm // inferred from electronic annotation /// 0009507 // chloroplast // inferred from electronic annotation,0003824 // catalytic activity // inferred from electronic annotation /// 0004022 // alcohol dehydrogenase (NAD) activity // inferred from electronic annotation /// 0005488 // binding // inferred from electronic annotation /// 0008270 // zinc ion binding // inferred from electronic annotation /// 0016491 // oxidoreductase activity // inferred from electronic annotation /// 0046872 // metal ion binding // inferred from electronic annotation,-149.2,159.15,-14.0682251521725,0.000970801657148402,0.0395428317849197,-4.43881024267808
7,245987_at,At5g13180,,Arabidopsis thaliana,Jun 9, 2011,Exemplar sequence,Affymetrix Proprietary Database,NAM-like protein hypothetical protein SENU5, senescence up-regulated - Lycopersicon esculentum, EMBL:Z75524; supported by cDNA: gi_14326559_gb_AF385734.1_AF385734,At5g13180,ANAC083 (ARABIDOPSIS NAC DOMAIN CONTAINING PROTEIN 83); transcription factor,ANAC083,831157,NM_121321,AT5G13180,0007275 // multicellular organismal development // inferred from sequence or structural similarity /// 0010089 // xylem development // inferred from mutant phenotype /// 0045449 // regulation of transcription // inferred from electronic annotation,,0003677 // DNA binding // inferred from electronic annotation /// 0003700 // sequence-specific DNA binding transcription factor activity // inferred from sequence or structural similarity /// 0005515 // protein binding // inferred from physical interaction /// 0005515 // protein binding // inferred from direct assay /// 0016564 // transcription repressor activity // inferred from direct assay,3913.55,5387.325,14.2354822320326,0.000938736922485912,0.0389319803670976,-4.43873536567165
8,245999_at,At5g20650,,Arabidopsis thaliana,Jun 9, 2011,Exemplar sequence,Affymetrix Proprietary Database,putative protein predicted protein, Arabidopsis thaliana;supported by full-length cDNA: Ceres:29453.,At5g20650,COPT5; copper ion transmembrane transporter/ high affinity copper ion transmembrane transporter,COPT5,832188,NM_122072,AT5G20650,0006810 // transport // inferred from electronic annotation /// 0006811 // ion transport // inferred from electronic annotation /// 0006825 // copper ion transport // inferred from electronic annotation /// 0006825 // copper ion transport // inferred from sequence or structural similarity,0005773 // vacuole // inferred from direct assay /// 0005886 // plasma membrane // inferred from direct assay /// 0016020 // membrane // inferred from electronic annotation /// 0016021 // integral to membrane // inferred from electronic annotation,0005375 // copper ion transmembrane transporter activity // inferred from sequence or structural similarity /// 0005375 // copper ion transmembrane transporter activity // inferred from electronic annotation /// 0015089 // high affinity copper ion transmembrane transporter activity // inferred from genetic interaction,507.65,1887.675,18.9326442126661,0.000416522035598415,0.0263734476682762,-4.43736546770907
9,246041_at,At5g19290,,Arabidopsis thaliana,Jun 9, 2011,Exemplar sequence,Affymetrix Proprietary Database,phospholipase - like protein various predicted phospholipase proteins;supported by full-length cDNA: Ceres:253499.,At5g19290,,,832049,NM_121934,AT5G19290,,,0003824 // catalytic activity // inferred from sequence or structural similarity,-878.899999999999,1783.1,-13.1825797535271,0.00116763556817764,0.043245631308366,-4.43925429839887
10,246138_at,At5g19870,,Arabidopsis thaliana,Jun 9, 2011,Exemplar sequence,Affymetrix Proprietary Database,putative protein predicted proteins from various organisms,At5g19870,,,832108,NM_121993,AT5G19870,,0012505 // endomembrane system // inferred from electronic annotation,,1516.35,765.325,152.730329189608,1.04113176842859e-06,0.00393054840688017,-4.435584866308
11,246139_at,At5g19900,,Arabidopsis thaliana,Jun 9, 2011,Exemplar sequence,Affymetrix Proprietary Database,putative protein predicted protein, Drosophila melanogaster,At5g19900,,,832112,NM_121997,AT5G19900,,0009507 // chloroplast // inferred from electronic annotation,,997.6,1037.3,12.594387341468,0.0013289572188964,0.0460333659336825,-4.43960107356493
12,246217_at,At4g36920,,Arabidopsis thaliana,Jun 9, 2011,Exemplar sequence,Affymetrix Proprietary Database,APETALA2 protein ; supported by cDNA: gi_533708_gb_U12546.1_ATU12546,At4g36920,AP2 (APETALA 2); transcription factor,AP2,829845,NM_119856,AT4G36920,0006350 // transcription // inferred from electronic annotation /// 0006355 // regulation of transcription, DNA-dependent // traceable author statement /// 0006355 // regulation of transcription, DNA-dependent // inferred from electronic annotation /// 0007275 // multicellular organismal development // inferred from electronic annotation /// 0009908 // flower development // traceable author statement /// 0009908 // flower development // inferred from electronic annotation /// 0010073 // meristem maintenance // inferred from mutant phenotype /// 0010093 // specification of floral organ identity // inferred from mutant phenotype /// 0019953 // sexual reproduction // traceable author statement /// 0030154 // cell differentiation // traceable author statement /// 0030154 // cell differentiation // inferred from electronic annotation /// 0045449 // regulation of transcription // inferred from electronic annotation /// 0048316 // seed development // inferred from mutant phenotype,0005634 // nucleus // inferred from sequence or structural similarity /// 0005634 // nucleus // traceable author statement /// 0005634 // nucleus // inferred from electronic annotation,0003677 // DNA binding // inferred from electronic annotation /// 0003700 // sequence-specific DNA binding transcription factor activity // inferred from sequence or structural similarity /// 0003700 // sequence-specific DNA binding transcription factor activity // traceable author statement /// 0003700 // sequence-specific DNA binding transcription factor activity // inferred from electronic annotation,155.65,158.675,18.6251832953542,0.000436459413682308,0.0266356461244903,-4.43742514994907
13,246228_at,At4g36430,,Arabidopsis thaliana,Jun 9, 2011,Exemplar sequence,Affymetrix Proprietary Database,peroxidase like protein,At4g36430,,,829795,NM_119806,AT4G36430,0006979 // response to oxidative stress // inferred from electronic annotation /// 0042744 // hydrogen peroxide catabolic process // inferred from electronic annotation /// 0051707 // response to other organism // inferred from expression pattern /// 0055114 // oxidation reduction // inferred from electronic annotation,0005576 // extracellular region // inferred from electronic annotation /// 0005618 // cell wall // inferred from direct assay,0004601 // peroxidase activity // inferred from electronic annotation /// 0004601 // peroxidase activity // inferred from sequence or structural similarity /// 0009055 // electron carrier activity // inferred from electronic annotation /// 0016491 // oxidoreductase activity // inferred from electronic annotation /// 0020037 // heme binding // inferred from electronic annotation /// 0046872 // metal ion binding // inferred from electronic annotation,2314.35,1229.675,14.7718183298036,0.0008450359434283,0.0367848661633579,-4.43851186047808
14,246249_at,At4g36680,,Arabidopsis thaliana,Jun 9, 2011,Exemplar sequence,Affymetrix Proprietary Database,salt-inducible like protein,At4g36680,,,829821,NM_119832,AT4G36680,,0005739 // mitochondrion // inferred from direct assay /// 0005739 // mitochondrion // inferred from electronic annotation,0005488 // binding // inferred from electronic annotation,493.15,473.975,63.3396345506095,1.30573606138965e-05,0.00760985432349771,-4.43571968235141
15,246254_at,At4g36450,,Arabidopsis thaliana,Jun 9, 2011,Exemplar sequence,Affymetrix Proprietary Database,MAP kinase like protein,At4g36450,ATMPK14 (Mitogen-activated protein kinase 14); MAP kinase/ kinase,ATMPK14,829797,NM_119808,AT4G36450,0006468 // protein phosphorylation // inferred from electronic annotation /// 0007165 // signal transduction // inferred by curator,,0000166 // nucleotide binding // inferred from electronic annotation /// 0004672 // protein kinase activity // inferred from electronic annotation /// 0004674 // protein serine/threonine kinase activity // inferred from electronic annotation /// 0004707 // MAP kinase activity // inferred from sequence or structural similarity /// 0004707 // MAP kinase activity // inferred from electronic annotation /// 0005524 // ATP binding // inferred from electronic annotation /// 0016301 // kinase activity // inferred from sequence or structural similarity /// 0016301 // kinase activity // inferred from electronic annotation /// 0016740 // transferase activity // inferred from electronic annotation,1661.6,886.15,34.8198402809776,7.27580233243045e-05,0.0137576909798439,-4.43609474044503
16,246275_at,At4g36540,,Arabidopsis thaliana,Jun 9, 2011,Exemplar sequence,Affymetrix Proprietary Database,putative protein ; supported by full-length cDNA: Ceres: 123997.,At4g36540,BEE2 (BR Enhanced Expression 2); DNA binding / transcription factor,BEE2,829806,NM_119817 /// NM_179177,AT4G36540,0006350 // transcription // inferred from electronic annotation /// 0045449 // regulation of transcription // traceable author statement /// 0045449 // regulation of transcription // inferred from electronic annotation,0005634 // nucleus // inferred from electronic annotation,0003677 // DNA binding // inferred from sequence or structural similarity /// 0003677 // DNA binding // inferred from electronic annotation /// 0003700 // sequence-specific DNA binding transcription factor activity // inferred from sequence or structural similarity /// 0030528 // transcription regulator activity // inferred from electronic annotation,106,60.4,13.7214555971102,0.00104212586311836,0.0411034743935557,-4.43897411253522
17,246322_at,At1g16680,,Arabidopsis thaliana,Jun 9, 2011,Exemplar sequence,Affymetrix Proprietary Database,S-locus protein, putative similar to S-locus protein 5 GI:6069485 from [Brassica rapa],At1g16680,,,838237,NM_101528,AT1G16680,0006457 // protein folding // inferred from electronic annotation /// 0006457 // protein folding // inferred from sequence or structural similarity,,0031072 // heat shock protein binding // inferred from electronic annotation /// 0051082 // unfolded protein binding // inferred from electronic annotation,265.45,223.275,17.0263272227813,0.00056386586021887,0.030050888485029,-4.43778869569554
18,246489_at,At5g16050,,Arabidopsis thaliana,Jun 9, 2011,Exemplar sequence,Affymetrix Proprietary Database,14-3-3 protein GF14upsilon (grf5) identical to 14-3-3 protein GF14 upsilon GI:2232148 from [Arabidopsis thaliana] ; supported by cDNA: gi_14334531_gb_AY035170.1_,At5g16050,GRF5 (GENERAL REGULATORY FACTOR 5); ATP binding / protein binding / protein phosphorylated amino acid binding,GRF5,831462,NM_121610,AT5G16050,0046686 // response to cadmium ion // inferred from expression pattern,0005618 // cell wall // inferred from direct assay /// 0005635 // nuclear envelope // inferred from direct assay /// 0005737 // cytoplasm // inferred from direct assay /// 0005739 // mitochondrion // inferred from direct assay /// 0005886 // plasma membrane // inferred from direct assay /// 0009570 // chloroplast stroma // inferred from direct assay,0005524 // ATP binding // inferred from direct assay /// 0019904 // protein domain specific binding // inferred from electronic annotation /// 0045309 // protein phosphorylated amino acid binding // traceable author statement,-144.3,1589.1,-17.6352649292807,0.00051008686080927,0.0285787857919209,-4.43763869452736
19,246498_at,At5g16230,,Arabidopsis thaliana,Jun 9, 2011,Exemplar sequence,Affymetrix Proprietary Database,stearoyl-acyl carrier protein desaturase stearoyl-acyl carrier protein desaturase sad1 - Linum usitatissimum, EMBL:AJ006957,At5g16230,,,831483,NM_121628,AT5G16230,0006631 // fatty acid metabolic process // inferred from electronic annotation /// 0006633 // fatty acid biosynthetic process // inferred from sequence or structural similarity /// 0055114 // oxidation reduction // inferred from electronic annotation,0009507 // chloroplast // inferred from electronic annotation,0016491 // oxidoreductase activity // inferred from electronic annotation /// 0045300 // acyl-[acyl-carrier-protein] desaturase activity // inferred from electronic annotation /// 0045300 // acyl-[acyl-carrier-protein] desaturase activity // inferred from sequence or structural similarity /// 0046914 // transition metal ion binding // inferred from electronic annotation,167.8,111.1,23.8994947194809,0.000213949409592026,0.0209421004680945,-4.43669540623258
20,246511_at,At5g15490,,Arabidopsis thaliana,Jun 9, 2011,Exemplar sequence,Affymetrix Proprietary Database,UDP-glucose dehydrogenase-like protein UDP-glucose 6-dehydrogenase - Glycine max, EMBL:U53418; supported by cDNA: gi_15810322_gb_AY056200.1_,At5g15490,,,831402,NM_121553,AT5G15490,0008152 // metabolic process // inferred from electronic annotation /// 0055114 // oxidation reduction // inferred from electronic annotation,0005618 // cell wall // inferred from direct assay /// 0005634 // nucleus // inferred from direct assay /// 0005829 // cytosol // inferred from direct assay,0003824 // catalytic activity // inferred from electronic annotation /// 0003979 // UDP-glucose 6-dehydrogenase activity // inferred from sequence or structural similarity /// 0005488 // binding // inferred from electronic annotation /// 0016491 // oxidoreductase activity // inferred from electronic annotation /// 0016616 // oxidoreductase activity, acting on the CH-OH group of donors, NAD or NADP as acceptor // inferred from electronic annotation /// 0050662 // coenzyme binding // inferred from electronic annotation /// 0051287 // NAD or NADH binding // inferred from electronic annotation,1564.15,1611.025,49.6003647359765,2.63535795085528e-05,0.0103551402814206,-4.43582226335811
21,246523_at,At5g15850,,Arabidopsis thaliana,Jun 9, 2011,Exemplar sequence,Affymetrix Proprietary Database,CONSTANS-like 1,At5g15850,COL1 (constans-like 1); transcription factor/ zinc ion binding,COL1,831442,NM_121590,AT5G15850,0006350 // transcription // inferred from electronic annotation /// 0007623 // circadian rhythm // inferred from mutant phenotype /// 0009909 // regulation of flower development // inferred from mutant phenotype /// 0045449 // regulation of transcription // inferred from electronic annotation,0005622 // intracellular // inferred from electronic annotation /// 0005634 // nucleus // inferred from electronic annotation,0003677 // DNA binding // inferred from electronic annotation /// 0003700 // sequence-specific DNA binding transcription factor activity // inferred from sequence or structural similarity /// 0005515 // protein binding // inferred from physical interaction /// 0008270 // zinc ion binding // inferred from sequence or structural similarity /// 0008270 // zinc ion binding // inferred from electronic annotation /// 0042802 // identical protein binding // inferred from physical interaction /// 0046872 // metal ion binding // inferred from electronic annotation,-595.85,970.475,-21.4483872662737,0.000291594463300979,0.0227327833311616,-4.4369686966803
22,246537_at,At5g15940,,Arabidopsis thaliana,Jun 9, 2011,Exemplar sequence,Affymetrix Proprietary Database,putative protein protochlorophyllide reductase homolog - Oryza sativa, EMBL:AF093628,At5g15940,,,831451,NM_121599,AT5G15940,0008152 // metabolic process // inferred from electronic annotation /// 0055114 // oxidation reduction // inferred from electronic annotation,,0003824 // catalytic activity // inferred from electronic annotation /// 0005488 // binding // inferred from electronic annotation /// 0016491 // oxidoreductase activity // inferred from electronic annotation /// 0016491 // oxidoreductase activity // inferred from sequence or structural similarity,310.4,199.85,33.9177675151497,7.84479489769821e-05,0.0142015691759124,-4.43612365620187
23,246549_at,At5g15050,,Arabidopsis thaliana,Jun 9, 2011,Exemplar sequence,Affymetrix Proprietary Database,putative protein predicted proteins, Arabidopsis thaliana;supported by full-length cDNA: Ceres:25053.,At5g15050,,,831357,NM_121509,AT5G15050,0016051 // carbohydrate biosynthetic process // inferred from sequence or structural similarity,0016020 // membrane // inferred from electronic annotation /// 0016020 // membrane // inferred from sequence or structural similarity,0008375 // acetylglucosaminyltransferase activity // inferred from sequence or structural similarity /// 0008375 // acetylglucosaminyltransferase activity // inferred from electronic annotation /// 0016757 // transferase activity, transferring glycosyl groups // inferred from sequence or structural similarity,1362.1,716.85,70.5425337301582,9.58262129037459e-06,0.00760985432349771,-4.4356881450469
24,246627_s_at,At1g48860,,Arabidopsis thaliana,Jun 9, 2011,Exemplar sequence,Affymetrix Proprietary Database,5-enolpyruvylshikimate-3-phosphate (EPSP) synthase, putative similar to 5-enolpyruvylshikimate-3-phosphate (EPSP) synthase GI:2583124 from (Arabidopsis thaliana);supported by full-length cDNA: Ceres:270032.,At1g48860,,,819138 /// 841308,NM_103780 /// NM_130093 /// NM_202267,AT1G48860 /// AT2G45300,0008652 // cellular amino acid biosynthetic process // inferred from electronic annotation /// 0009073 // aromatic amino acid family biosynthetic process // traceable author statement /// 0009073 // aromatic amino acid family biosynthetic process // inferred from electronic annotation /// 0009423 // chorismate biosynthetic process // inferred from mutant phenotype /// 0018920 // glyphosate metabolic process // inferred from mutant phenotype,0005737 // cytoplasm // inferred from electronic annotation /// 0009507 // chloroplast // inferred from direct assay /// 0009507 // chloroplast // traceable author statement /// 0009507 // chloroplast // inferred from electronic annotation /// 0009536 // plastid // inferred from electronic annotation,0003824 // catalytic activity // inferred from electronic annotation /// 0003866 // 3-phosphoshikimate 1-carboxyvinyltransferase activity // inferred from mutant phenotype /// 0003866 // 3-phosphoshikimate 1-carboxyvinyltransferase activity // inferred from electronic annotation /// 0016740 // transferase activity // inferred from electronic annotation /// 0016765 // transferase activity, transferring alkyl or aryl (other than methyl) groups // inferred from electronic annotation,-649.65,3450.575,-37.8882048522447,5.71014677690833e-05,0.0131564088869979,-4.43601132200435
