,ID,ORF,SPOT_ID,Species.Scientific.Name,Annotation.Date,Sequence.Type,Sequence.Source,Target.Description,Representative.Public.ID,Gene.Title,Gene.Symbol,ENTREZ_GENE_ID,RefSeq.Transcript.ID,AGI,Gene.Ontology.Biological.Process,Gene.Ontology.Cellular.Component,Gene.Ontology.Molecular.Function,logFC,AveExpr,t,P.Value,adj.P.Val,B
227,257502_at,At1g78110,,Arabidopsis thaliana,Jun 9, 2011,Exemplar sequence,Affymetrix Proprietary Database,unknown protein,At1g78110,,,844147,NM_106461,AT1G78110,,0005886 // plasma membrane // inferred from direct assay,,110.1,64.9,12.4616838900071,0.0013694425053945,0.0464836064703103,-4.43968600149929
228,257517_at,At3g16330,,Arabidopsis thaliana,Jun 9, 2011,Exemplar sequence,Affymetrix Proprietary Database,unknown protein,At3g16330,,,820880,NM_112504,AT3G16330,,,,1140.55,1191.825,38.3504560031908,5.51485749822273e-05,0.0131564088869979,-4.43600045451058
229,257540_at,At3g21520,,Arabidopsis thaliana,Jun 9, 2011,Exemplar sequence,Affymetrix Proprietary Database,hypothetical protein,At3g21520,,,821706,NM_113047,AT3G21520,,,,-277.8,645.5,-25.3022412335009,0.000181712776734611,0.019737468749126,-4.43657324317931
230,257583_at,At1g66480,,Arabidopsis thaliana,Jun 9, 2011,Exemplar sequence,Affymetrix Proprietary Database,hypothetical protein,At1g66480,PMI2 (plastid movement impaired 2),PMI2,842966,NM_105319,AT1G66480,0009637 // response to blue light // inferred from mutant phenotype /// 0009903 // chloroplast avoidance movement // inferred from mutant phenotype,0005886 // plasma membrane // inferred from direct assay,,-528.5,1366.35,-23.9045106736082,0.000213820917096964,0.0209421004680945,-4.43669493099677
231,258183_at,At3g21550,,Arabidopsis thaliana,Jun 9, 2011,Exemplar sequence,Affymetrix Proprietary Database,unknown protein  ;supported by full-length cDNA: Ceres:7192.,At3g21550,,,821709,NM_113050,AT3G21550,,,,9819.65,4961.825,88.4132744419151,5.00876431935319e-06,0.00655376949196126,-4.43564044817944
232,258188_at,At3g17800,,Arabidopsis thaliana,Jun 9, 2011,Exemplar sequence,Affymetrix Proprietary Database,unknown protein  ;supported by full-length cDNA: Ceres:15577.,At3g17800,,,821048,NM_001084704 /// NM_112661,AT3G17800,0010224 // response to UV-B // inferred from expression pattern /// 0010224 // response to UV-B // inferred from genetic interaction,0009507 // chloroplast // inferred from electronic annotation,,2950.75,6419.775,16.5869497103487,0.000607503381121526,0.0311275788984424,-4.43790719192017
233,258194_at,At3g29170,,Arabidopsis thaliana,Jun 9, 2011,Exemplar sequence,Affymetrix Proprietary Database,unknown protein  ; supported by full-length cDNA: Ceres: 11852.,At3g29170,,,822567,NM_113840,AT3G29170,,,,157.55,788.225,14.9653257668857,0.000814321135610269,0.0359751700859554,-4.43843695320402
234,258201_at,At3g13910,,Arabidopsis thaliana,Jun 9, 2011,Exemplar sequence,Affymetrix Proprietary Database,hypothetical protein predicted by genscan+supported by full-length cDNA: Ceres:17883.,At3g13910,,,820604,NM_112245,AT3G13910,,0005886 // plasma membrane // inferred from direct assay,,-1011.65,2558.725,-24.2871449245353,0.00020431767209736,0.0208387268670038,-4.4366595357942
235,258251_at,At3g15810,,Arabidopsis thaliana,Jun 9, 2011,Exemplar sequence,Affymetrix Proprietary Database,unknown protein  ; supported by full-length cDNA: Ceres: 2528.,At3g15810,,,820824,NM_112451,AT3G15810,,,,2217.1,3761,11.8423713453421,0.00158199199235263,0.0499104250975981,-4.44011976293495
236,258262_at,At3g15770,,Arabidopsis thaliana,Jun 9, 2011,Exemplar sequence,Affymetrix Proprietary Database,hypothetical protein,At3g15770,,,820820,NM_001035628 /// NM_112447,AT3G15770,,,,290.25,771.475,12.3862414371883,0.001393199255101,0.0466650146972891,-4.43973547348747
237,258300_at,At3g23340,,Arabidopsis thaliana,Jun 9, 2011,Exemplar sequence,Affymetrix Proprietary Database,putative casein kinase I similar to casein kinase I GB:CAA55396 from [Arabidopsis thaliana]; supported by cDNA: gi_15809823_gb_AY054179.1_,At3g23340,ckl10 (Casein Kinase I-like 10); ATP binding / kinase/ protein kinase/ protein serine/threonine kinase,ckl10,821915,NM_113237,AT3G23340,0006468 // protein phosphorylation // inferred from electronic annotation,,0000166 // nucleotide binding // inferred from electronic annotation /// 0004672 // protein kinase activity // inferred from electronic annotation /// 0004674 // protein serine/threonine kinase activity // inferred from electronic annotation /// 0005524 // ATP binding // inferred from electronic annotation /// 0016301 // kinase activity // inferred from sequence or structural similarity /// 0016301 // kinase activity // inferred from electronic annotation,278.95,195.025,29.8888774580792,0.000112737291818292,0.0156801074778978,-4.43628620961275
238,258349_at,At3g17610,,Arabidopsis thaliana,Jun 9, 2011,Exemplar sequence,Affymetrix Proprietary Database,Expressed protein ; supported by full-length cDNA: Ceres: 35429.,At3g17610,HYH (HY5-HOMOLOG); DNA binding / transcription factor,HYH,821027,NM_001035640 /// NM_001084700 /// NM_180273 /// NM_180274,AT3G17609,0006350 // transcription // inferred from electronic annotation /// 0006355 // regulation of transcription, DNA-dependent // inferred from sequence or structural similarity /// 0006355 // regulation of transcription, DNA-dependent // inferred from electronic annotation /// 0009585 // red, far-red light phototransduction // inferred from electronic annotation /// 0010017 // red or far-red light signaling pathway // inferred from electronic annotation /// 0010224 // response to UV-B // inferred from expression pattern /// 0045449 // regulation of transcription // inferred from electronic annotation,0005634 // nucleus // inferred from electronic annotation,0003677 // DNA binding // inferred from sequence or structural similarity /// 0003677 // DNA binding // inferred from electronic annotation /// 0003700 // sequence-specific DNA binding transcription factor activity // inferred from sequence or structural similarity /// 0003700 // sequence-specific DNA binding transcription factor activity // inferred from electronic annotation /// 0005515 // protein binding // inferred from physical interaction /// 0043565 // sequence-specific DNA binding // inferred from electronic annotation /// 0046983 // protein dimerization activity // inferred from electronic annotation,-207.4,917.9,-16.7471764282591,0.000591080533343948,0.0306838536829936,-4.43786291402252
239,258351_at,At3g17700,,Arabidopsis thaliana,Jun 9, 2011,Exemplar sequence,Affymetrix Proprietary Database,hypothetical protein contains similarity to ion channel protein from [Arabidopsis thaliana]; supported by cDNA: gi_8131897_gb_AF148541.1_AF148541,At3g17700,CNBT1 (CYCLIC NUCLEOTIDE-BINDING TRANSPORTER 1); calmodulin binding / cyclic nucleotide binding / ion channel,CNBT1,821037,NM_112651,AT3G17700,0006810 // transport // inferred from electronic annotation /// 0006811 // ion transport // inferred from electronic annotation /// 0009624 // response to nematode // inferred from expression pattern /// 0055085 // transmembrane transport // inferred from electronic annotation,0009507 // chloroplast // inferred from electronic annotation /// 0009535 // chloroplast thylakoid membrane // inferred from electronic annotation /// 0009536 // plastid // inferred from electronic annotation /// 0009579 // thylakoid // inferred from electronic annotation /// 0016020 // membrane // inferred from electronic annotation /// 0016021 // integral to membrane // inferred from electronic annotation,0000166 // nucleotide binding // inferred from electronic annotation /// 0005216 // ion channel activity // inferred from sequence or structural similarity /// 0005216 // ion channel activity // inferred from electronic annotation /// 0005516 // calmodulin binding // inferred from sequence or structural similarity /// 0005516 // calmodulin binding // inferred from electronic annotation /// 0030551 // cyclic nucleotide binding // inferred from sequence or structural similarity /// 0030552 // cAMP binding // inferred from electronic annotation /// 0030553 // cGMP binding // inferred from electronic annotation,-260.5,1144.7,-16.9315065533051,0.000572917333940584,0.0301743228214124,-4.43781350028849
240,258357_at,At3g14350,,Arabidopsis thaliana,Jun 9, 2011,Exemplar sequence,Affymetrix Proprietary Database,putative leucine-rich repeat transmembrane protein kinase similar to leucine-rich repeat transmembrane protein kinase 1 GB:AAC27894 from [Zea mays],At3g14350,SRF7 (STRUBBELIG-RECEPTOR FAMILY 7); ATP binding / protein binding / protein kinase/ protein serine/threonine kinase/ protein tyrosine kinase,SRF7,820655,NM_112293 /// NM_202582 /// NM_202583,AT3G14350,0006468 // protein phosphorylation // inferred from electronic annotation /// 0006468 // protein phosphorylation // inferred from sequence or structural similarity /// 0007169 // transmembrane receptor protein tyrosine kinase signaling pathway // inferred from sequence or structural similarity,0005634 // nucleus // inferred from direct assay /// 0005829 // cytosol // inferred from direct assay /// 0005886 // plasma membrane // inferred from direct assay /// 0016020 // membrane // inferred from electronic annotation /// 0016021 // integral to membrane // inferred from electronic annotation,0000166 // nucleotide binding // inferred from electronic annotation /// 0004672 // protein kinase activity // inferred from electronic annotation /// 0004674 // protein serine/threonine kinase activity // inferred from electronic annotation /// 0004674 // protein serine/threonine kinase activity // inferred from sequence or structural similarity /// 0004713 // protein tyrosine kinase activity // inferred from electronic annotation /// 0004872 // receptor activity // inferred from electronic annotation /// 0005515 // protein binding // inferred from electronic annotation /// 0005524 // ATP binding // inferred from electronic annotation /// 0005524 // ATP binding // inferred from sequence or structural similarity /// 0016301 // kinase activity // inferred from electronic annotation,1185.15,743.275,72.373197610199,8.90263939317359e-06,0.00760985432349771,-4.43568159030224
241,258374_at,At3g14360,,Arabidopsis thaliana,Jun 9, 2011,Exemplar sequence,Affymetrix Proprietary Database,hypothetical protein predicted by genscan+; supported by cDNA: gi_15810242_gb_AY056160.1_,At3g14360,,,820657,NM_112294,AT3G14360,0006629 // lipid metabolic process // inferred from electronic annotation /// 0006629 // lipid metabolic process // inferred from sequence or structural similarity,,0004806 // triglyceride lipase activity // inferred from electronic annotation /// 0004806 // triglyceride lipase activity // inferred from sequence or structural similarity /// 0016787 // hydrolase activity // inferred from electronic annotation,2823.15,1503.775,34.878667496209,7.24065369287734e-05,0.0137576909798439,-4.43609293203311
242,258500_at,At3g02470,,Arabidopsis thaliana,Jun 9, 2011,Exemplar sequence,Affymetrix Proprietary Database,S-adenosylmethionine decarboxylase identical to GB:Q96286 from [Arabidopsis thaliana]; supported by cDNA: gi_14596072_gb_AY042824.1_,At3g02470,CPuORF9 (Conserved peptide upstream open reading frame 9),CPuORF9,6241331 /// 821214,NM_001084624 /// NM_001125085 /// NM_001161113 /// NM_111114,AT3G02468 /// AT3G02470,0006596 // polyamine biosynthetic process // traceable author statement /// 0006596 // polyamine biosynthetic process // inferred from electronic annotation /// 0006597 // spermine biosynthetic process // inferred from electronic annotation /// 0008295 // spermidine biosynthetic process // inferred from electronic annotation,,0004014 // adenosylmethionine decarboxylase activity // inferred from direct assay /// 0004014 // adenosylmethionine decarboxylase activity // inferred from sequence or structural similarity /// 0004014 // adenosylmethionine decarboxylase activity // inferred from electronic annotation /// 0016829 // lyase activity // inferred from electronic annotation /// 0016831 // carboxy-lyase activity // inferred from electronic annotation,-1085.4,9024.75,-16.4858328293735,0.000618184710258413,0.0311275788984424,-4.43793579217228
243,258516_at,At3g06490,,Arabidopsis thaliana,Jun 9, 2011,Exemplar sequence,Affymetrix Proprietary Database,myb-related protein, putative similar to dehydration-induced myb-related protein Cpm7 GB:T09737 from [Craterostigma plantagineum]; supported by cDNA: gi_15375290_gb_AF262733.2_AF262733,At3g06490,MYB108 (myb domain protein 108); DNA binding / transcription factor,MYB108,819827,NM_111525,AT3G06490,0006355 // regulation of transcription, DNA-dependent // inferred from sequence or structural similarity /// 0009620 // response to fungus // inferred from mutant phenotype /// 0009651 // response to salt stress // inferred from expression pattern /// 0009723 // response to ethylene stimulus // inferred from expression pattern /// 0009737 // response to abscisic acid stimulus // inferred from expression pattern /// 0009753 // response to jasmonic acid stimulus // inferred from expression pattern /// 0045449 // regulation of transcription // inferred from electronic annotation,0005634 // nucleus // inferred from electronic annotation,0003677 // DNA binding // inferred from sequence or structural similarity /// 0003677 // DNA binding // inferred from electronic annotation /// 0003700 // sequence-specific DNA binding transcription factor activity // inferred from sequence or structural similarity,-1906.35,6852.525,-98.7933175462684,3.64085816118115e-06,0.00553653164376947,-4.43562380760665
244,258551_at,At3g06890,,Arabidopsis thaliana,Jun 9, 2011,Exemplar sequence,Affymetrix Proprietary Database,hypothetical protein predicted by genscan+;supported by full-length cDNA: Ceres:262487.,At3g06890,,,819874,NM_111569,AT3G06890,,,,515.4,548.55,14.3179515709517,0.000923449727582799,0.0386260059116758,-4.43869938943105
245,258797_at,At3g04730,,Arabidopsis thaliana,Jun 9, 2011,Exemplar sequence,Affymetrix Proprietary Database,auxin-induced protein identical to GB:AAB84353 (IAA16) [Arabidopsis thaliana]; early auxin-induced gene; member of a multigene family of early auxin-induced genes isolated from Arabidopsis using yeast two-hybrid system with IAA1;supported by full-length cDNA: Ceres:32727.,At3g04730,IAA16; transcription factor,IAA16,819633,NM_111345,AT3G04730,0006350 // transcription // inferred from electronic annotation /// 0009733 // response to auxin stimulus // traceable author statement /// 0009734 // auxin mediated signaling pathway // inferred from electronic annotation /// 0045449 // regulation of transcription // inferred from electronic annotation,0005634 // nucleus // inferred from electronic annotation,0003700 // sequence-specific DNA binding transcription factor activity // inferred from sequence or structural similarity /// 0046983 // protein dimerization activity // inferred from electronic annotation,-1038.85,4002.775,-23.0067705646643,0.000238579489908371,0.0213476252292854,-4.43678496433118
246,258813_at,At3g04060,,Arabidopsis thaliana,Jun 9, 2011,Exemplar sequence,Affymetrix Proprietary Database,NAM-like protein (no apical meristem) similar to NAM GB:CAA63101 [Petunia x hybrida]; supported by full-length cDNA: Ceres: 119460.,At3g04060,anac046 (Arabidopsis NAC domain containing protein 46); transcription factor,anac046,819561,NM_111277,AT3G04060,0007275 // multicellular organismal development // inferred from sequence or structural similarity /// 0045449 // regulation of transcription // inferred from electronic annotation,,0003677 // DNA binding // inferred from electronic annotation /// 0003700 // sequence-specific DNA binding transcription factor activity // inferred from sequence or structural similarity,993.15,1385.825,25.630899081981,0.000175118807126782,0.0191122487586693,-4.43654746364936
247,258850_at,At3g03050,,Arabidopsis thaliana,Jun 9, 2011,Exemplar sequence,Affymetrix Proprietary Database,putative cellulose synthase catalytic subunit similar to cellulose synthase catalytic subunit GB:AAD40885 from [Arabidopsis thaliana]; supported by cDNA: gi_12619787_gb_AF232907.1_AF232907,At3g03050,CSLD3 (CELLULOSE SYNTHASE-LIKE D3); cellulose synthase/ transferase, transferring glycosyl groups,CSLD3,821148,NM_111175,AT3G03050,0000271 // polysaccharide biosynthetic process // inferred from sequence or structural similarity /// 0007047 // cellular cell wall organization // inferred from electronic annotation /// 0009409 // response to cold // inferred from expression pattern /// 0009832 // plant-type cell wall biogenesis // inferred from sequence or structural similarity /// 0030244 // cellulose biosynthetic process // inferred from electronic annotation,0000139 // Golgi membrane // inferred from electronic annotation /// 0005783 // endoplasmic reticulum // inferred from direct assay /// 0005794 // Golgi apparatus // inferred from direct assay /// 0005794 // Golgi apparatus // inferred from electronic annotation /// 0005886 // plasma membrane // inferred from direct assay /// 0016020 // membrane // inferred from electronic annotation /// 0016021 // integral to membrane // inferred from electronic annotation,0016740 // transferase activity // inferred from electronic annotation /// 0016757 // transferase activity, transferring glycosyl groups // inferred from sequence or structural similarity /// 0016757 // transferase activity, transferring glycosyl groups // inferred from electronic annotation /// 0016759 // cellulose synthase activity // inferred from sequence or structural similarity /// 0016760 // cellulose synthase (UDP-forming) activity // inferred from electronic annotation,-149,925.25,-12.7637884176554,0.00127957776381688,0.0450419271491715,-4.439496390994
248,258868_at,At3g03110,,Arabidopsis thaliana,Jun 9, 2011,Exemplar sequence,Affymetrix Proprietary Database,putative exportin1 (XPO1) protein similar to GB:CAB56597,At3g03110,XPO1B; binding / protein transporter,XPO1B,821074,NM_111181,AT3G03110,0000059 // protein import into nucleus, docking // inferred from sequence or structural similarity /// 0006886 // intracellular protein transport // inferred from electronic annotation /// 0009553 // embryo sac development // inferred from genetic interaction /// 0009555 // pollen development // inferred from genetic interaction /// 0009846 // pollen germination // inferred from genetic interaction /// 0009860 // pollen tube growth // inferred from genetic interaction,0005634 // nucleus // inferred from electronic annotation /// 0005634 // nucleus // inferred from sequence or structural similarity /// 0005643 // nuclear pore // inferred from electronic annotation /// 0005643 // nuclear pore // inferred from sequence or structural similarity /// 0005737 // cytoplasm // inferred from electronic annotation /// 0005737 // cytoplasm // inferred from sequence or structural similarity,0005488 // binding // inferred from electronic annotation /// 0008565 // protein transporter activity // inferred from electronic annotation /// 0008565 // protein transporter activity // inferred from sequence or structural similarity,882.6,1499.45,19.8736715224775,0.000362621746076615,0.0250804954721295,-4.43719952274581
249,258900_at,At3g05590,,Arabidopsis thaliana,Jun 9, 2011,Exemplar sequence,Affymetrix Proprietary Database,putative 60S ribosomal protein L18 similar to GB:P42791; supported by cDNA: gi_14335089_gb_AY037224.1_,At3g05590,RPL18 (RIBOSOMAL PROTEIN L18); structural constituent of ribosome,RPL18,819725,NM_111432,AT3G05590,0006412 // translation // inferred from sequence or structural similarity /// 0006412 // translation // traceable author statement /// 0006412 // translation // inferred from electronic annotation,0005622 // intracellular // inferred from electronic annotation /// 0005737 // cytoplasm // inferred from electronic annotation /// 0005773 // vacuole // inferred from direct assay /// 0005840 // ribosome // inferred from electronic annotation /// 0005886 // plasma membrane // inferred from direct assay /// 0009507 // chloroplast // inferred from direct assay /// 0015934 // large ribosomal subunit // inferred from direct assay /// 0015934 // large ribosomal subunit // inferred from sequence or structural similarity /// 0015934 // large ribosomal subunit // traceable author statement /// 0022625 // cytosolic large ribosomal subunit // inferred from direct assay /// 0030529 // ribonucleoprotein complex // inferred from electronic annotation,0003735 // structural constituent of ribosome // inferred from sequence or structural similarity /// 0003735 // structural constituent of ribosome // traceable author statement /// 0003735 // structural constituent of ribosome // inferred from electronic annotation,-194.5,1982.1,-22.6215891177616,0.000250389400563306,0.0216882868219672,-4.43682689394754
250,258910_at,At3g06480,,Arabidopsis thaliana,Jun 9, 2011,Exemplar sequence,Affymetrix Proprietary Database,putative RNA helicase similar to RNA helicase (DRH1) GB:BAA28347 [Arabidopsis thaliana]; Pfam HMM hits: WW/rsp5/WWP domain containing proteins, DEAD and DEAH box helicases, Helicases conserved C-terminal domain,At3g06480,,,819825,NM_111523,AT3G06480,0000184 // nuclear-transcribed mRNA catabolic process, nonsense-mediated decay // inferred from electronic annotation /// 0006364 // rRNA processing // inferred from electronic annotation /// 0042254 // ribosome biogenesis // inferred from electronic annotation,0005634 // nucleus // inferred from electronic annotation /// 0005773 // vacuole // inferred from direct assay,0000166 // nucleotide binding // inferred from electronic annotation /// 0003676 // nucleic acid binding // inferred from electronic annotation /// 0003723 // RNA binding // inferred from electronic annotation /// 0004386 // helicase activity // inferred from electronic annotation /// 0005515 // protein binding // inferred from electronic annotation /// 0005524 // ATP binding // inferred from electronic annotation /// 0005524 // ATP binding // inferred from sequence or structural similarity /// 0008026 // ATP-dependent helicase activity // inferred from electronic annotation /// 0008026 // ATP-dependent helicase activity // inferred from sequence or structural similarity /// 0016787 // hydrolase activity // inferred from electronic annotation,-139.6,625.05,-19.2884043128045,0.000394952342289223,0.025813360824118,-4.43729990175559
251,259220_at,At3g03550,,Arabidopsis thaliana,Jun 9, 2011,Exemplar sequence,Affymetrix Proprietary Database,expressed protein predicted by genefinder, single EST match; contains zinc finger domain, C3HC4 type (RING finger); supported by cDNA: Ceres: 152633.,At3g03550,,,821237,NM_111226,AT3G03550,,0016020 // membrane // inferred from electronic annotation /// 0016021 // integral to membrane // inferred from electronic annotation,0005515 // protein binding // inferred from sequence or structural similarity /// 0005515 // protein binding // inferred from electronic annotation /// 0008270 // zinc ion binding // inferred from electronic annotation /// 0008270 // zinc ion binding // inferred from sequence or structural similarity /// 0046872 // metal ion binding // inferred from electronic annotation,135.85,209.125,14.8936021756531,0.000825527765804105,0.0362622146601168,-4.43846438340681
252,259221_s_at,At3g03540,,Arabidopsis thaliana,Jun 9, 2011,Exemplar sequence,Affymetrix Proprietary Database,putative phospholipase similar to unknown protein GB:AAC32238 [Arabidopsis thaliana], potential phospholipase C- similar to multiple phospholipase  proteins from Mycobacterium species: GB:CAB06146, GB:CAB06147, GB:AAC18944, GB:CAB44656,At3g03540,NPC5 (NON-SPECIFIC PHOSPHOLIPASE C5); hydrolase, acting on ester bonds / phospholipase C,NPC5,821241 /// 821243,NM_111224 /// NM_111225,AT3G03530 /// AT3G03540,0009247 // glycolipid biosynthetic process // inferred from mutant phenotype /// 0009395 // phospholipid catabolic process // inferred from mutant phenotype /// 0009395 // phospholipid catabolic process // inferred from direct assay /// 0016036 // cellular response to phosphate starvation // inferred from mutant phenotype,0005829 // cytosol // inferred from direct assay /// 0005886 // plasma membrane // inferred from direct assay,0004629 // phospholipase C activity // inferred from direct assay /// 0016788 // hydrolase activity, acting on ester bonds // inferred from sequence or structural similarity /// 0016788 // hydrolase activity, acting on ester bonds // inferred from electronic annotation,633.1,325.65,19.7239152424583,0.000370544803774995,0.0250804954721295,-4.43722436763216
253,259228_at,At3g07720,,Arabidopsis thaliana,Jun 9, 2011,Exemplar sequence,Affymetrix Proprietary Database,unknown protein similar to hypothetical protein GB:S33464 [Arabidopsis thaliana]; supported by cDNA: gi_14517447_gb_AY039559.1_,At3g07720,,,819963,NM_111651,AT3G07720,0010043 // response to zinc ion // inferred from expression pattern,0005634 // nucleus // inferred from direct assay /// 0005737 // cytoplasm // inferred from direct assay,,656.8,1104.05,16.2836256217219,0.000640314444508366,0.0314775268949048,-4.43799456730243
254,259406_at,At1g17690,,Arabidopsis thaliana,Jun 9, 2011,Exemplar sequence,Affymetrix Proprietary Database,hypothetical protein predicted by genemark.hmm; supported by cDNA: gi_15810522_gb_AY056300.1_,At1g17690,,,838345,NM_101631,AT1G17690,,,,-213.4,1015.35,-11.9885917643644,0.00152801767797036,0.0488893129975664,-4.44001143065157
