,ID,ORF,SPOT_ID,Species.Scientific.Name,Annotation.Date,Sequence.Type,Sequence.Source,Target.Description,Representative.Public.ID,Gene.Title,Gene.Symbol,ENTREZ_GENE_ID,RefSeq.Transcript.ID,AGI,Gene.Ontology.Biological.Process,Gene.Ontology.Cellular.Component,Gene.Ontology.Molecular.Function,logFC,AveExpr,t,P.Value,adj.P.Val,B
113,251090_at,At5g01340,,Arabidopsis thaliana,Jun 9, 2011,Exemplar sequence,Affymetrix Proprietary Database,putative protein ACR1-protein - Saccharomyces cerevisiae, EMBL:SCACR1PRA;supported by full-length cDNA: Ceres:37798.,At5g01340,,,831479,NM_120212,AT5G01340,0006810 // transport // inferred from electronic annotation /// 0006810 // transport // inferred from sequence or structural similarity /// 0006839 // mitochondrial transport // inferred from sequence or structural similarity /// 0055085 // transmembrane transport // inferred from electronic annotation,0005743 // mitochondrial inner membrane // inferred from electronic annotation /// 0005743 // mitochondrial inner membrane // inferred from sequence or structural similarity /// 0016020 // membrane // inferred from electronic annotation /// 0016021 // integral to membrane // inferred from electronic annotation,0005215 // transporter activity // inferred from electronic annotation /// 0005488 // binding // inferred from electronic annotation /// 0005488 // binding // inferred from sequence or structural similarity,303.05,589.725,12.367245447696,0.00139926817124698,0.0467410967110605,-4.43974806944852
114,251097_at,At5g01560,,Arabidopsis thaliana,Jun 9, 2011,Exemplar sequence,Affymetrix Proprietary Database,receptor like protein kinase receptor like protein kinase - Arabidopsis thaliana, EMBL:ATLECGENE,At5g01560,LECRKA4.3 (LECTIN RECEPTOR KINASE A4.3); kinase,LECRKA4.3,830345,NM_120234,AT5G01560,0006468 // protein phosphorylation // inferred from electronic annotation /// 0009738 // abscisic acid mediated signaling pathway // inferred from mutant phenotype /// 0009845 // seed germination // inferred from mutant phenotype,0005886 // plasma membrane // inferred from electronic annotation /// 0005886 // plasma membrane // inferred from expression pattern /// 0016020 // membrane // inferred from electronic annotation /// 0016021 // integral to membrane // inferred from electronic annotation,0000166 // nucleotide binding // inferred from electronic annotation /// 0004672 // protein kinase activity // inferred from electronic annotation /// 0004674 // protein serine/threonine kinase activity // inferred from electronic annotation /// 0004872 // receptor activity // inferred from electronic annotation /// 0005488 // binding // inferred from electronic annotation /// 0005524 // ATP binding // inferred from electronic annotation /// 0005529 // sugar binding // inferred from electronic annotation /// 0016301 // kinase activity // inferred from sequence or structural similarity /// 0016301 // kinase activity // inferred from electronic annotation /// 0016740 // transferase activity // inferred from electronic annotation,-669.6,1392.3,-15.2890378879333,0.000766208566481715,0.0349544348028959,-4.43831783473139
115,251143_at,At5g01220,,Arabidopsis thaliana,Jun 9, 2011,Exemplar sequence,Affymetrix Proprietary Database,putative protein SqdX protein, Synechococcus PCC7942, EMBL:SP45308; supported by cDNA: gi_15028316_gb_AY045961.1_,At5g01220,SQD2 (sulfoquinovosyldiacylglycerol 2); UDP-glycosyltransferase/ UDP-sulfoquinovose:DAG sulfoquinovosyltransferase/ transferase, transferring glycosyl groups,SQD2,831888,NM_120200,AT5G01220,0009058 // biosynthetic process // inferred from electronic annotation /// 0009247 // glycolipid biosynthetic process // inferred from direct assay /// 0016036 // cellular response to phosphate starvation // inferred from mutant phenotype /// 0046506 // sulfolipid biosynthetic process // traceable author statement,0009507 // chloroplast // inferred from direct assay /// 0009941 // chloroplast envelope // inferred from direct assay,0008194 // UDP-glycosyltransferase activity // inferred from direct assay /// 0016757 // transferase activity, transferring glycosyl groups // inferred from sequence or structural similarity /// 0046510 // UDP-sulfoquinovose:DAG sulfoquinovosyltransferase activity // inferred from direct assay,477.45,423.225,18.0457295137067,0.000477670859345072,0.0279376212863105,-4.43754593158316
116,251177_at,At3g63400,,Arabidopsis thaliana,Jun 9, 2011,Exemplar sequence,Affymetrix Proprietary Database,cyclophylin -like protein CDC28/cdc2-like kinase associating arginine-serine cyclophilin, Homo sapiens, PIR:JC5314,At3g63400,,,825515,NM_116205 /// NM_180409,AT3G63400,0006457 // protein folding // inferred from sequence or structural similarity /// 0006457 // protein folding // inferred from electronic annotation /// 0008380 // RNA splicing // non-traceable author statement,,0003755 // peptidyl-prolyl cis-trans isomerase activity // inferred from electronic annotation /// 0003755 // peptidyl-prolyl cis-trans isomerase activity // inferred from sequence or structural similarity /// 0005515 // protein binding // inferred from physical interaction /// 0016853 // isomerase activity // inferred from electronic annotation,-248.8,779.7,-15.4362951476767,0.00074558412900062,0.0343654037816148,-4.43826606909062
117,251207_at,At3g63050,,Arabidopsis thaliana,Jun 9, 2011,Exemplar sequence,Affymetrix Proprietary Database,putative protein  ;supported by full-length cDNA: Ceres:15076.,At3g63050,,,825480,NM_116170,AT3G63050,,,,560.8,343.95,27.462137780921,0.000143704952296851,0.0175289302774929,-4.43642026780522
118,251273_at,At3g61960,,Arabidopsis thaliana,Jun 9, 2011,Exemplar sequence,Affymetrix Proprietary Database,serine/threonine-protein kinase-like protein serine/threonine kinase UNC51.2 - Mus musculus, EMBL:AF145922; supported by cDNA: gi_14334751_gb_AY035049.1_,At3g61960,,,825369,NM_001035839 /// NM_116061,AT3G61960,0006468 // protein phosphorylation // inferred from electronic annotation,,0000166 // nucleotide binding // inferred from electronic annotation /// 0004672 // protein kinase activity // inferred from electronic annotation /// 0004674 // protein serine/threonine kinase activity // inferred from electronic annotation /// 0005524 // ATP binding // inferred from electronic annotation /// 0016301 // kinase activity // inferred from sequence or structural similarity /// 0016301 // kinase activity // inferred from electronic annotation,1469.1,1171.6,18.7480290675521,0.000428342585876115,0.0265388077240605,-4.43740095557771
119,251286_at,At3g61710,,Arabidopsis thaliana,Jun 9, 2011,Exemplar sequence,Affymetrix Proprietary Database,putative protein Bcl-2-interacting protein beclin 1 - Homo sapiens, EMBL:AF139131; supported by cDNA: gi_14517555_gb_AY039613.1_,At3g61710,,,825344,NM_001035837 /// NM_116036 /// NM_202746,AT3G61710,0000045 // autophagic vacuole assembly // inferred from genetic interaction /// 0006623 // protein targeting to vacuole // inferred from genetic interaction /// 0006914 // autophagy // inferred from sequence or structural similarity /// 0006914 // autophagy // inferred from electronic annotation /// 0009846 // pollen germination // inferred from mutant phenotype,0000407 // pre-autophagosomal structure // inferred from direct assay,,395.4,1305.8,13.9185537298149,0.00100075523937185,0.0400042783269691,-4.43887950113057
120,251297_at,At3g62020,,Arabidopsis thaliana,Jun 9, 2011,Exemplar sequence,Affymetrix Proprietary Database,germin-like protein (GLP10),At3g62020,GLP10 (GERMIN-LIKE PROTEIN 10); manganese ion binding / nutrient reservoir,GLP10,825375,NM_116067 /// NM_202748,AT3G62020,,0005576 // extracellular region // inferred from electronic annotation /// 0005618 // cell wall // inferred from direct assay /// 0009505 // plant-type cell wall // inferred from direct assay /// 0048046 // apoplast // inferred from electronic annotation,0030145 // manganese ion binding // inferred from electronic annotation /// 0045735 // nutrient reservoir activity // inferred from electronic annotation /// 0046872 // metal ion binding // inferred from electronic annotation,314.35,193.375,13.0938996279592,0.00119020786336213,0.0434553769097711,-4.43930367469462
121,251302_at,At3g61970,,Arabidopsis thaliana,Jun 9, 2011,Exemplar sequence,Affymetrix Proprietary Database,RAV-like protein DNA-binding protein RAV1 - Arabidopsis thaliana, EMBL:AB013886;supported by full-length cDNA: Ceres:13757.,At3g61970,NGA2 (NGATHA2); transcription factor,NGA2,825370,NM_116062,AT3G61970,0006350 // transcription // inferred from electronic annotation /// 0006355 // regulation of transcription, DNA-dependent // inferred from electronic annotation /// 0009908 // flower development // inferred from mutant phenotype /// 0045449 // regulation of transcription // inferred from electronic annotation /// 0048366 // leaf development // inferred from mutant phenotype,0005634 // nucleus // inferred from electronic annotation,0003677 // DNA binding // inferred from electronic annotation /// 0003700 // sequence-specific DNA binding transcription factor activity // inferred from sequence or structural similarity,492.65,348.875,13.1074488226954,0.00118672138672085,0.0434553769097711,-4.43929606721634
122,251305_at,At3g62030,,Arabidopsis thaliana,Jun 9, 2011,Exemplar sequence,Affymetrix Proprietary Database,peptidylprolyl isomerase ROC4  ;supported by full-length cDNA: Ceres:29220.,At3g62030,peptidyl-prolyl cis-trans isomerase, chloroplast / cyclophilin / rotamase / cyclosporin A-binding protein (ROC4),ROC4,825376,NM_001161212 /// NM_116068,AT3G62030,0006457 // protein folding // inferred from sequence or structural similarity /// 0006457 // protein folding // inferred from electronic annotation /// 0006979 // response to oxidative stress // inferred from mutant phenotype /// 0007165 // signal transduction // inferred from sequence or structural similarity /// 0009642 // response to light intensity // inferred from mutant phenotype /// 0009651 // response to salt stress // inferred from mutant phenotype /// 0009737 // response to abscisic acid stimulus // inferred from expression pattern /// 0010555 // response to mannitol stimulus // inferred from mutant phenotype /// 0019344 // cysteine biosynthetic process // inferred from mutant phenotype /// 0042742 // defense response to bacterium // inferred from expression pattern /// 0045036 // protein targeting to chloroplast // inferred from direct assay,0009507 // chloroplast // inferred from direct assay /// 0009507 // chloroplast // inferred from electronic annotation /// 0009535 // chloroplast thylakoid membrane // inferred from direct assay /// 0009536 // plastid // inferred from electronic annotation /// 0009570 // chloroplast stroma // inferred from direct assay /// 0009570 // chloroplast stroma // inferred from electronic annotation /// 0009579 // thylakoid // inferred from direct assay /// 0009941 // chloroplast envelope // inferred from direct assay /// 0022626 // cytosolic ribosome // inferred from direct assay /// 0031977 // thylakoid lumen // inferred from direct assay /// 0048046 // apoplast // inferred from direct assay,0003755 // peptidyl-prolyl cis-trans isomerase activity // inferred from direct assay /// 0003755 // peptidyl-prolyl cis-trans isomerase activity // inferred from sequence or structural similarity /// 0003755 // peptidyl-prolyl cis-trans isomerase activity // inferred from electronic annotation /// 0005515 // protein binding // inferred from physical interaction /// 0016853 // isomerase activity // inferred from electronic annotation /// 0042277 // peptide binding // inferred from electronic annotation,384.45,3806.725,14.7462891456552,0.000849203772809802,0.0368958820148411,-4.43852195963672
123,251317_at,At3g61490,,Arabidopsis thaliana,Jun 9, 2011,Exemplar sequence,Affymetrix Proprietary Database,putative protein polygalacturonase - Zea mays, EMBL:ZMPGAL3,At3g61490,,,825322,NM_116014 /// NM_202744,AT3G61490,0005975 // carbohydrate metabolic process // inferred from electronic annotation /// 0005975 // carbohydrate metabolic process // inferred from sequence or structural similarity /// 0007047 // cellular cell wall organization // inferred from electronic annotation /// 0008152 // metabolic process // inferred from electronic annotation,0012505 // endomembrane system // inferred from electronic annotation,0004650 // polygalacturonase activity // inferred from electronic annotation /// 0004650 // polygalacturonase activity // inferred from sequence or structural similarity /// 0016787 // hydrolase activity // inferred from electronic annotation /// 0016798 // hydrolase activity, acting on glycosyl bonds // inferred from electronic annotation,259.75,223.775,17.5290650817473,0.000518953538139893,0.0288012900364257,-4.43766374864285
124,251321_at,At3g61460,,Arabidopsis thaliana,Jun 9, 2011,Exemplar sequence,Affymetrix Proprietary Database,RING finger protein  ;supported by full-length cDNA: Ceres:25801.,At3g61460,BRH1 (BRASSINOSTEROID-RESPONSIVE RING-H2); protein binding / zinc ion binding,BRH1,825319,NM_116011,AT3G61460,0009741 // response to brassinosteroid stimulus // inferred from expression pattern /// 0010200 // response to chitin // inferred from expression pattern,0012505 // endomembrane system // inferred from electronic annotation,0005515 // protein binding // inferred from sequence or structural similarity /// 0005515 // protein binding // inferred from electronic annotation /// 0008270 // zinc ion binding // inferred from electronic annotation /// 0008270 // zinc ion binding // inferred from sequence or structural similarity /// 0046872 // metal ion binding // inferred from electronic annotation,131.2,208.1,12.9858864375894,0.00121850009183549,0.0439167757401534,-4.43936515491513
125,251333_at,At3g61690,,Arabidopsis thaliana,Jun 9, 2011,Exemplar sequence,Affymetrix Proprietary Database,putative protein putative protein F26O13.260 - Arabidopsis thaliana, EMBL:AL133452,At3g61690,,,825342,NM_116034,AT3G61690,,,0016779 // nucleotidyltransferase activity // inferred from electronic annotation,343.05,417.325,11.9034947154452,0.00155912311759408,0.0496698300451412,-4.44007400548753
126,251342_at,At3g60690,,Arabidopsis thaliana,Jun 9, 2011,Exemplar sequence,Affymetrix Proprietary Database,putative protein SAUR-AC1, Arabidopsis thaliana, PIR:T06084; supported by cDNA: gi_14190478_gb_AF380639.1_AF380639,At3g60690,,,825240,NM_115933,AT3G60690,0009733 // response to auxin stimulus // inferred from sequence or structural similarity,,,-1924.25,5172.475,-16.9190690027864,0.000574119075164094,0.0301743228214124,-4.43781678442862
127,251365_at,At3g61310,,Arabidopsis thaliana,Jun 9, 2011,Exemplar sequence,Affymetrix Proprietary Database,putative DNA-binding protein At2g33620 AT-hook DNA-binding protein - Arabidopsis thaliana, EMBL:ATAC2332,At3g61310,,,825303,NM_115995,AT3G61310,,,0003677 // DNA binding // inferred from electronic annotation /// 0003677 // DNA binding // inferred from sequence or structural similarity,704,500.85,15.0110183683721,0.000807288230742863,0.0358952135345901,-4.43841967939539
128,251379_at,At3g60680,,Arabidopsis thaliana,Jun 9, 2011,Exemplar sequence,Affymetrix Proprietary Database,putative protein various predicted Arabidopsis thaliana proteins,At3g60680,,,825239,NM_115932,AT3G60680,,,,813.5,2009.65,11.8853624752086,0.00156586061128438,0.0497068327183425,-4.4400875078766
129,251429_at,At3g60190,,Arabidopsis thaliana,Jun 9, 2011,Exemplar sequence,Affymetrix Proprietary Database,dynamin-like protein 4 (ADL4)  ; supported by cDNA: gi_6651400_gb_AF180733.1_AF180733,At3g60190,ADL1E (ARABIDOPSIS DYNAMIN-LIKE 1E); GTP binding / GTPase,ADL1E,825189,NM_115882,AT3G60190,0007049 // cell cycle // inferred from electronic annotation /// 0016192 // vesicle-mediated transport // inferred from sequence or structural similarity /// 0046686 // response to cadmium ion // inferred from expression pattern /// 0050832 // defense response to fungus // inferred from mutant phenotype /// 0051301 // cell division // inferred from electronic annotation,0005737 // cytoplasm // inferred from electronic annotation /// 0005739 // mitochondrion // inferred from direct assay /// 0005773 // vacuole // inferred from direct assay /// 0005856 // cytoskeleton // inferred from electronic annotation /// 0005874 // microtubule // inferred from electronic annotation /// 0005886 // plasma membrane // inferred from direct assay /// 0009524 // phragmoplast // inferred from electronic annotation,0000166 // nucleotide binding // inferred from electronic annotation /// 0003774 // motor activity // inferred from electronic annotation /// 0003924 // GTPase activity // inferred from electronic annotation /// 0003924 // GTPase activity // inferred from sequence or structural similarity /// 0005525 // GTP binding // inferred from electronic annotation /// 0005525 // GTP binding // inferred from sequence or structural similarity /// 0016787 // hydrolase activity // inferred from electronic annotation,-1115.05,3253.425,-15.1572731614198,0.000785318608287906,0.0355418997123951,-4.4383654167325
130,251475_at,At3g59660,,Arabidopsis thaliana,Jun 9, 2011,Exemplar sequence,Affymetrix Proprietary Database,putative protein other hypothetical proteins,At3g59660,,,825135,NM_115828,AT3G59660,,0012505 // endomembrane system // inferred from electronic annotation,,-273.2,1181.6,-19.8437610483361,0.000364185847369035,0.0250804954721295,-4.43720444049737
131,251478_at,At3g59690,,Arabidopsis thaliana,Jun 9, 2011,Exemplar sequence,Affymetrix Proprietary Database,putative protein SF16 protein, pollen specific - Helianthus annuus, PIR:T13992,At3g59690,IQD13 (IQ-domain 13); calmodulin binding,IQD13,825138,NM_115831,AT3G59690,,0005886 // plasma membrane // inferred from direct assay,0005516 // calmodulin binding // inferred from sequence or structural similarity,260.95,216.425,16.3668145607421,0.000631083206980975,0.0312785813995582,-4.43797012705448
132,251500_at,At3g59110,,Arabidopsis thaliana,Jun 9, 2011,Exemplar sequence,Affymetrix Proprietary Database,receptor-like protein kinase receptor-like protein kinase (RKS2) - Arabidopsis thaliana, EMBL:AF084036,At3g59110,,,825080,NM_115773,AT3G59110,0006468 // protein phosphorylation // inferred from electronic annotation,0005886 // plasma membrane // inferred from direct assay,0000166 // nucleotide binding // inferred from electronic annotation /// 0004672 // protein kinase activity // inferred from electronic annotation /// 0004674 // protein serine/threonine kinase activity // inferred from electronic annotation /// 0004872 // receptor activity // inferred from electronic annotation /// 0005524 // ATP binding // inferred from electronic annotation /// 0016301 // kinase activity // inferred from sequence or structural similarity /// 0016301 // kinase activity // inferred from electronic annotation,598.45,370.975,28.4165045097007,0.000130302977255533,0.0166978141078579,-4.43636345955796
133,251507_at,At3g59080,,Arabidopsis thaliana,Jun 9, 2011,Exemplar sequence,Affymetrix Proprietary Database,putative protein CND41, chloroplast nucleoid DNA binding protein - Nicotiana tabacum, EMBL:D26015; supported by cDNA: gi_15983375_gb_AF424562.1_AF424562,At3g59080,,,825077,NM_001035814 /// NM_115770,AT3G59080,0006508 // proteolysis // inferred from electronic annotation,0012505 // endomembrane system // inferred from electronic annotation,0003677 // DNA binding // inferred from sequence or structural similarity /// 0004190 // aspartic-type endopeptidase activity // inferred from electronic annotation /// 0008233 // peptidase activity // inferred from electronic annotation /// 0016787 // hydrolase activity // inferred from electronic annotation,-627.699999999999,2691.85,-16.8916386116366,0.000576781466325066,0.030244563785919,-4.43782405273309
134,251561_at,At3g57870,,Arabidopsis thaliana,Jun 9, 2011,Exemplar sequence,Affymetrix Proprietary Database,E2 ubiquitin-conjugating-like enzyme Ahus5  ; supported by cDNA: gi_14596100_gb_AY042838.1_,At3g57870,SCE1 (SUMO CONJUGATION ENZYME 1); SUMO ligase,SCE1,824956,NM_115649,AT3G57870,0009737 // response to abscisic acid stimulus // inferred from mutant phenotype /// 0009793 // embryo development ending in seed dormancy // inferred from mutant phenotype /// 0009793 // embryo development ending in seed dormancy // non-traceable author statement /// 0016925 // protein sumoylation // inferred from direct assay /// 0043687 // post-translational protein modification // inferred from electronic annotation /// 0051246 // regulation of protein metabolic process // inferred from electronic annotation,0005634 // nucleus // inferred from direct assay,0000166 // nucleotide binding // inferred from electronic annotation /// 0005515 // protein binding // inferred from physical interaction /// 0005524 // ATP binding // inferred from electronic annotation /// 0016874 // ligase activity // inferred from electronic annotation /// 0019787 // small conjugating protein ligase activity // inferred from electronic annotation /// 0019789 // SUMO ligase activity // inferred from direct assay,4362.7,6208.25,21.1099009490344,0.000305165621883627,0.0230490987919388,-4.43701402686414
135,251597_at,At3g57750,,Arabidopsis thaliana,Jun 9, 2011,Exemplar sequence,Affymetrix Proprietary Database,protein kinase - like protein wall-associated kinase 1, Arabidopsis thaliana, AJ009696;supported by full-length cDNA: Ceres:105330.,At3g57750,,,824944,NM_001035801 /// NM_115635,AT3G57750,0006468 // protein phosphorylation // inferred from electronic annotation,,0004672 // protein kinase activity // inferred from electronic annotation /// 0005524 // ATP binding // inferred from electronic annotation /// 0016301 // kinase activity // inferred from sequence or structural similarity /// 0016301 // kinase activity // inferred from electronic annotation,-202.75,731.325,-21.7860899441152,0.000278852118960834,0.0227164886910594,-4.43692554270908
136,251624_at,At3g57280,,Arabidopsis thaliana,Jun 9, 2011,Exemplar sequence,Affymetrix Proprietary Database,hypothetical protein  ;supported by full-length cDNA: Ceres:14487.,At3g57280,,,824895,NM_115588,AT3G57280,,0009507 // chloroplast // inferred from direct assay /// 0009706 // chloroplast inner membrane // inferred from direct assay /// 0009941 // chloroplast envelope // inferred from direct assay /// 0016020 // membrane // inferred from electronic annotation,,-1837.6,8160.05,-24.9545192286964,0.000189058526616755,0.0201648584530367,-4.43660162736666
137,251630_at,At3g57420,,Arabidopsis thaliana,Jun 9, 2011,Exemplar sequence,Affymetrix Proprietary Database,putative protein unknown protein - Arbidopsis thaliana, EMBL:AC002339,At3g57420,,,824909,NM_115602,AT3G57420,,0005618 // cell wall // inferred from direct assay,,399,494.95,16.8401897095555,0.000581820054255747,0.0303691428777427,-4.4378377798369
138,251665_at,At3g57040,,Arabidopsis thaliana,Jun 9, 2011,Exemplar sequence,Affymetrix Proprietary Database,responce reactor 4  ; supported by cDNA: gi_3273201_dbj_AB010918.1_AB010918,At3g57040,ARR9 (RESPONSE REGULATOR 9); transcription regulator/ two-component response regulator,ARR9,824871,NM_115563,AT3G57040,0000160 // two-component signal transduction system (phosphorelay) // inferred from physical interaction /// 0000160 // two-component signal transduction system (phosphorelay) // inferred from electronic annotation /// 0006350 // transcription // inferred from electronic annotation /// 0006355 // regulation of transcription, DNA-dependent // inferred from electronic annotation /// 0007623 // circadian rhythm // inferred from mutant phenotype /// 0009735 // response to cytokinin stimulus // inferred from expression pattern /// 0009736 // cytokinin mediated signaling pathway // inferred from mutant phenotype /// 0009736 // cytokinin mediated signaling pathway // traceable author statement /// 0009736 // cytokinin mediated signaling pathway // inferred from electronic annotation /// 0045449 // regulation of transcription // inferred from electronic annotation,0005634 // nucleus // inferred from direct assay /// 0005634 // nucleus // inferred from electronic annotation,0000156 // two-component response regulator activity // inferred from sequence or structural similarity /// 0000156 // two-component response regulator activity // inferred from electronic annotation /// 0005515 // protein binding // inferred from physical interaction /// 0030528 // transcription regulator activity // traceable author statement,533.45,615.075,25.1533071165737,0.000184811145781113,0.0199788731529251,-4.43658525736666
139,251679_at,At3g57030,,Arabidopsis thaliana,Jun 9, 2011,Exemplar sequence,Affymetrix Proprietary Database,putative protein strictosidine synthase (EC 4.3.3.2) - Rauvolfia mannii (fragment),At3g57030,,,824870,NM_115562,AT3G57030,0009058 // biosynthetic process // inferred from electronic annotation /// 0009821 // alkaloid biosynthetic process // inferred from sequence or structural similarity,0005783 // endoplasmic reticulum // inferred from direct assay /// 0005886 // plasma membrane // inferred from direct assay /// 0009505 // plant-type cell wall // inferred from direct assay,0016844 // strictosidine synthase activity // inferred from sequence or structural similarity /// 0016844 // strictosidine synthase activity // traceable author statement /// 0016844 // strictosidine synthase activity // inferred from electronic annotation,-111.35,265.625,-11.8769458754917,0.00156900129580038,0.0497068327183425,-4.44009379583163
140,251704_at,At3g56360,,Arabidopsis thaliana,Jun 9, 2011,Exemplar sequence,Affymetrix Proprietary Database,putative protein unknown protein 110K5.12 - Sorghum bicolor, TREMBL:AF124045_5;supported by full-length cDNA: Ceres:142358.,At3g56360,,,824803,NM_115494,AT3G56360,,0009507 // chloroplast // inferred from electronic annotation,,1788.25,2962.975,19.732241883591,0.000370098187393376,0.0250804954721295,-4.43722297150983
