,ID,ORF,SPOT_ID,Species.Scientific.Name,Annotation.Date,Sequence.Type,Sequence.Source,Target.Description,Representative.Public.ID,Gene.Title,Gene.Symbol,ENTREZ_GENE_ID,RefSeq.Transcript.ID,AGI,Gene.Ontology.Biological.Process,Gene.Ontology.Cellular.Component,Gene.Ontology.Molecular.Function,logFC,AveExpr,t,P.Value,adj.P.Val,B
323,263865_at,At2g36910,,Arabidopsis thaliana,Jun 9, 2011,Exemplar sequence,Affymetrix Proprietary Database,putative ABC transporter related to multi drug resistance proteins and P-glycoproteins,At2g36910,ABCB1 (ATP BINDING CASSETTE SUBFAMILY B1); ATPase, coupled to transmembrane movement of substances / auxin efflux transmembrane transporter/ calmodulin binding,ABCB1,818265,NM_129247,AT2G36910,0006810 // transport // inferred from electronic annotation /// 0008361 // regulation of cell size // inferred from mutant phenotype /// 0009624 // response to nematode // inferred from expression pattern /// 0009637 // response to blue light // inferred from mutant phenotype /// 0009639 // response to red or far red light // inferred from mutant phenotype /// 0009640 // photomorphogenesis // inferred from mutant phenotype /// 0009733 // response to auxin stimulus // inferred from mutant phenotype /// 0009734 // auxin mediated signaling pathway // inferred from electronic annotation /// 0009926 // auxin polar transport // inferred from mutant phenotype /// 0009926 // auxin polar transport // traceable author statement /// 0009958 // positive gravitropism // inferred from genetic interaction /// 0043481 // anthocyanin accumulation in tissues in response to UV light // inferred from mutant phenotype /// 0048443 // stamen development // inferred from genetic interaction /// 0055085 // transmembrane transport // inferred from electronic annotation,0005886 // plasma membrane // inferred from direct assay /// 0005886 // plasma membrane // inferred from electronic annotation /// 0016020 // membrane // inferred from electronic annotation /// 0016021 // integral to membrane // inferred from electronic annotation,0000166 // nucleotide binding // inferred from electronic annotation /// 0005515 // protein binding // inferred from physical interaction /// 0005516 // calmodulin binding // inferred from sequence or structural similarity /// 0005524 // ATP binding // inferred from electronic annotation /// 0010329 // auxin efflux transmembrane transporter activity // inferred from direct assay /// 0016887 // ATPase activity // inferred from electronic annotation /// 0017111 // nucleoside-triphosphatase activity // inferred from electronic annotation /// 0042626 // ATPase activity, coupled to transmembrane movement of substances // inferred from sequence or structural similarity /// 0042626 // ATPase activity, coupled to transmembrane movement of substances // inferred from electronic annotation,-220.6,834.75,-12.9786382366562,0.00122043084246116,0.0439167757401534,-4.439369334276
324,263866_at,At2g36950,,Arabidopsis thaliana,Jun 9, 2011,Exemplar sequence,Affymetrix Proprietary Database,putative farnesylated protein  ;supported by full-length cDNA: Ceres:19570.,At2g36950,,,818269,NM_129251,AT2G36950,0030001 // metal ion transport // inferred from electronic annotation,,0005507 // copper ion binding // inferred from direct assay /// 0046872 // metal ion binding // inferred from sequence or structural similarity /// 0046872 // metal ion binding // inferred from electronic annotation,-3415.84999999999,19479.575,-15.2946154101634,0.000765413508987157,0.0349544348028959,-4.43831584723628
325,263875_at,At2g21970,,Arabidopsis thaliana,Jun 9, 2011,Exemplar sequence,Affymetrix Proprietary Database,unknown protein  ;supported by full-length cDNA: Ceres:10672.,At2g21970,SEP2 (STRESS ENHANCED PROTEIN 2); chlorophyll binding,SEP2,816733,NM_127766,AT2G21970,0009765 // photosynthesis, light harvesting // inferred from sequence or structural similarity,0009535 // chloroplast thylakoid membrane // inferred from direct assay,0016168 // chlorophyll binding // inferred from sequence or structural similarity,737.1,570.4,16.9846322434616,0.000567822143345795,0.0301743228214124,-4.43779955242852
326,264006_at,At2g22430,,Arabidopsis thaliana,Jun 9, 2011,Exemplar sequence,Affymetrix Proprietary Database,homeodomain transcription factor (ATHB-6)  ; supported by cDNA: gi_16974586_gb_AY060569.1_,At2g22430,ATHB6; DNA binding / protein binding / sequence-specific DNA binding / transcription activator/ transcription factor,ATHB6,816775,NM_127808,AT2G22430,0006350 // transcription // inferred from electronic annotation /// 0006355 // regulation of transcription, DNA-dependent // inferred from sequence or structural similarity /// 0006355 // regulation of transcription, DNA-dependent // inferred from electronic annotation /// 0006950 // response to stress // inferred from electronic annotation /// 0009414 // response to water deprivation // inferred from expression pattern /// 0009738 // abscisic acid mediated signaling pathway // traceable author statement /// 0009738 // abscisic acid mediated signaling pathway // inferred from electronic annotation /// 0009788 // negative regulation of abscisic acid mediated signaling pathway // inferred from mutant phenotype /// 0045449 // regulation of transcription // inferred from electronic annotation /// 0045941 // positive regulation of transcription // inferred from direct assay,0005634 // nucleus // inferred from electronic annotation /// 0005634 // nucleus // inferred from sequence or structural similarity,0003677 // DNA binding // inferred from direct assay /// 0003677 // DNA binding // inferred from electronic annotation /// 0003700 // sequence-specific DNA binding transcription factor activity // inferred from sequence or structural similarity /// 0003700 // sequence-specific DNA binding transcription factor activity // traceable author statement /// 0003700 // sequence-specific DNA binding transcription factor activity // inferred from electronic annotation /// 0005515 // protein binding // inferred from physical interaction /// 0016563 // transcription activator activity // inferred from direct assay /// 0030528 // transcription regulator activity // inferred from electronic annotation /// 0043565 // sequence-specific DNA binding // inferred from direct assay /// 0043565 // sequence-specific DNA binding // inferred from electronic annotation,-525.15,1092.075,-21.6946841985565,0.000282225864806285,0.0227286697362099,-4.43693702619831
327,264034_s_at,At2g03600,,Arabidopsis thaliana,Jun 9, 2011,Exemplar sequence,Affymetrix Proprietary Database,unknown protein,At2g03600,ATUPS1 (ARABIDOPSIS THALIANA UREIDE PERMEASE 1); allantoin uptake transmembrane transporter,ATUPS1,814888 /// 814889,NM_001124785 /// NM_001124786 /// NM_126409 /// NM_126410,AT2G03590 /// AT2G03600,0006810 // transport // inferred from electronic annotation /// 0015720 // allantoin transport // inferred from direct assay,0012505 // endomembrane system // inferred from electronic annotation /// 0016020 // membrane // inferred from electronic annotation /// 0016021 // integral to membrane // inferred from electronic annotation,0000166 // nucleotide binding // inferred from electronic annotation /// 0005274 // allantoin uptake transmembrane transporter activity // inferred from direct assay /// 0005524 // ATP binding // inferred from electronic annotation,483,334.3,12.0793358281673,0.00149575902562757,0.0481216690755499,-4.43994611535887
328,264053_at,At2g22560,,Arabidopsis thaliana,Jun 9, 2011,Exemplar sequence,Affymetrix Proprietary Database,hypothetical protein predicted by genscan and genefinder,At2g22560,,,816788,NM_127822,AT2G22560,,0005886 // plasma membrane // inferred from direct assay,,436.15,477.075,17.7150873420779,0.000503556147800439,0.0285233864403826,-4.43762015531331
329,264071_at,At2g27920,,Arabidopsis thaliana,Jun 9, 2011,Exemplar sequence,Affymetrix Proprietary Database,putative carboxypeptidase  ; supported by cDNA: gi_15724217_gb_AF412049.1_AF412049,At2g27920,SCPL51 (SERINE CARBOXYPEPTIDASE-LIKE 51); serine-type carboxypeptidase,SCPL51,817336,NM_001036357 /// NM_128351 /// NM_201822,AT2G27920,0006508 // proteolysis // inferred from electronic annotation /// 0006508 // proteolysis // inferred from sequence or structural similarity,0005576 // extracellular region // inferred from electronic annotation /// 0005739 // mitochondrion // inferred from electronic annotation /// 0012505 // endomembrane system // inferred from electronic annotation,0004180 // carboxypeptidase activity // inferred from electronic annotation /// 0004185 // serine-type carboxypeptidase activity // inferred from electronic annotation /// 0004185 // serine-type carboxypeptidase activity // inferred from sequence or structural similarity /// 0008233 // peptidase activity // inferred from electronic annotation /// 0016787 // hydrolase activity // inferred from electronic annotation,455.6,247.05,26.6160260031224,0.000157185705574183,0.0180395191870241,-4.43647579769794
330,264078_at,At2g28470,,Arabidopsis thaliana,Jun 9, 2011,Exemplar sequence,Affymetrix Proprietary Database,putative beta-galactosidase,At2g28470,BGAL8 (beta-galactosidase 8); beta-galactosidase/ catalytic/ cation binding / sugar binding,BGAL8,817395,NM_179790,AT2G28470,0005975 // carbohydrate metabolic process // inferred from electronic annotation /// 0008152 // metabolic process // inferred from electronic annotation,0005576 // extracellular region // inferred from electronic annotation /// 0005618 // cell wall // inferred from direct assay /// 0048046 // apoplast // inferred from electronic annotation,0003824 // catalytic activity // inferred from electronic annotation /// 0004553 // hydrolase activity, hydrolyzing O-glycosyl compounds // inferred from electronic annotation /// 0004565 // beta-galactosidase activity // inferred from electronic annotation /// 0004565 // beta-galactosidase activity // inferred from sequence or structural similarity /// 0005529 // sugar binding // inferred from electronic annotation /// 0016787 // hydrolase activity // inferred from electronic annotation /// 0016798 // hydrolase activity, acting on glycosyl bonds // inferred from electronic annotation /// 0043169 // cation binding // inferred from electronic annotation,433.55,319.175,35.3253498604756,6.98108479590748e-05,0.0137576909798439,-4.43607949300501
331,264091_at,At1g79110,,Arabidopsis thaliana,Jun 9, 2011,Exemplar sequence,Affymetrix Proprietary Database,hypothetical protein predicted by genscan+;supported by full-length cDNA: Ceres:36412.,At1g79110,,,844252,NM_106562 /// NM_202445,AT1G79110,,,0005515 // protein binding // inferred from electronic annotation /// 0008270 // zinc ion binding // inferred from electronic annotation,100.6,65.6,14.5391724247018,0.00088406094025432,0.0377135081531282,-4.43860583277546
332,264135_at,At1g79030,,Arabidopsis thaliana,Jun 9, 2011,Exemplar sequence,Affymetrix Proprietary Database,S-locus protein, putative similar to S-locus protein 5 GI:6069485 from [Brassica rapa],At1g79030,,,844244,NM_106554,AT1G79030,0006457 // protein folding // inferred from electronic annotation /// 0006457 // protein folding // inferred from sequence or structural similarity,,0031072 // heat shock protein binding // inferred from electronic annotation /// 0051082 // unfolded protein binding // inferred from electronic annotation,364.9,229.75,21.8259398234273,0.000277398266902456,0.0226790482725628,-4.43692058100766
333,264158_at,At1g65260,,Arabidopsis thaliana,Jun 9, 2011,Exemplar sequence,Affymetrix Proprietary Database,hypothetical protein contains similarity to chloroplast membrane-associated protein IM30 GI:169106 from [Pisum sativum];supported by full-length cDNA: Ceres:32284.,At1g65260,PTAC4 (PLASTID TRANSCRIPTIONALLY ACTIVE4),PTAC4,842833,NM_105199,AT1G65260,0010027 // thylakoid membrane organization // inferred from mutant phenotype /// 0016050 // vesicle organization // inferred from mutant phenotype,0009295 // nucleoid // inferred from direct assay /// 0009507 // chloroplast // inferred from direct assay /// 0009507 // chloroplast // inferred from electronic annotation /// 0009508 // plastid chromosome // inferred from direct assay /// 0009528 // plastid inner membrane // inferred from electronic annotation /// 0009534 // chloroplast thylakoid // inferred from direct assay /// 0009535 // chloroplast thylakoid membrane // inferred from direct assay /// 0009535 // chloroplast thylakoid membrane // inferred from electronic annotation /// 0009536 // plastid // inferred from electronic annotation /// 0009570 // chloroplast stroma // inferred from direct assay /// 0009579 // thylakoid // inferred from electronic annotation /// 0009706 // chloroplast inner membrane // inferred from electronic annotation /// 0009941 // chloroplast envelope // inferred from direct assay /// 0016020 // membrane // inferred from sequence or structural similarity /// 0016020 // membrane // inferred from electronic annotation,,-126.1,2040.45,-12.2805603752756,0.00142741791747191,0.0472139290630892,-4.43980627338198
334,264184_at,At1g54790,,Arabidopsis thaliana,Jun 9, 2011,Exemplar sequence,Affymetrix Proprietary Database,early nodule-specific protein, putative similar to early nodule-specific protein (ENOD8) GI:304036 from [Medicago sativa];supported by full-length cDNA: Ceres:122943.,At1g54790,,,841920,NM_104354 /// NM_202300,AT1G54790,0006629 // lipid metabolic process // inferred from electronic annotation /// 0016042 // lipid catabolic process // inferred from electronic annotation,0005576 // extracellular region // inferred from electronic annotation /// 0012505 // endomembrane system // inferred from electronic annotation,0004091 // carboxylesterase activity // inferred from sequence or structural similarity /// 0016787 // hydrolase activity // inferred from electronic annotation /// 0016788 // hydrolase activity, acting on ester bonds // inferred from electronic annotation,392.1,225.55,28.2568212475256,0.000132424533167513,0.0167632437295694,-4.43637256722654
335,264200_at,At1g22650,,Arabidopsis thaliana,Jun 9, 2011,Exemplar sequence,Affymetrix Proprietary Database,putative invertase Similar to LIM17 gene product gb|1653769 from the genome of Synechocystis sp. gb|D90916;supported by full-length cDNA: Ceres:6399.,At1g22650,,,838871,NM_102112,AT1G22650,,,0003824 // catalytic activity // inferred from electronic annotation /// 0004564 // beta-fructofuranosidase activity // inferred from sequence or structural similarity,625.05,598.575,14.0424805368915,0.000975867278999304,0.0396077093131212,-4.43882200133511
336,264217_at,At1g60190,,Arabidopsis thaliana,Jun 9, 2011,Exemplar sequence,Affymetrix Proprietary Database,hypothetical protein predicted by genemark.hmm,At1g60190,,,842314,NM_104709,AT1G60190,0016567 // protein ubiquitination // inferred from electronic annotation,0000151 // ubiquitin ligase complex // inferred from electronic annotation,0004842 // ubiquitin-protein ligase activity // inferred from electronic annotation /// 0005488 // binding // inferred from electronic annotation /// 0005515 // protein binding // inferred from electronic annotation /// 0008270 // zinc ion binding // inferred from electronic annotation /// 0016874 // ligase activity // inferred from electronic annotation,498.25,536.425,42.0478779676392,4.23454694344858e-05,0.012063189523819,-4.43592599590525
337,264682_at,At1g65570,,Arabidopsis thaliana,Jun 9, 2011,Exemplar sequence,Affymetrix Proprietary Database,polygalacturonase, putative similar to polygalacturonase GI:2605891 from [Lycopersicon esculentum],At1g65570,,,842868,NM_105231,AT1G65570,0005975 // carbohydrate metabolic process // inferred from electronic annotation /// 0005975 // carbohydrate metabolic process // inferred from sequence or structural similarity /// 0007047 // cellular cell wall organization // inferred from electronic annotation /// 0008152 // metabolic process // inferred from electronic annotation,0012505 // endomembrane system // inferred from electronic annotation,0004650 // polygalacturonase activity // inferred from electronic annotation /// 0004650 // polygalacturonase activity // inferred from sequence or structural similarity /// 0016787 // hydrolase activity // inferred from electronic annotation /// 0016798 // hydrolase activity, acting on glycosyl bonds // inferred from electronic annotation,3177.5,1601.75,29.3203859115825,0.000119117482254348,0.0158892969018811,-4.43631466642868
338,265061_at,At1g61640,,Arabidopsis thaliana,Jun 9, 2011,Exemplar sequence,Affymetrix Proprietary Database,hypothetical protein contains similarity to ABC transporter protein GI:6626257 from [Methanobacterium thermoautotrophicum],At1g61640,,,842460,NM_104846 /// NM_202336,AT1G61640,,,,-429.45,1346.425,-13.0824998118514,0.00119315192881128,0.0434553769097711,-4.43931009325105
339,265067_at,At1g03850,,Arabidopsis thaliana,Jun 9, 2011,Exemplar sequence,Affymetrix Proprietary Database,hypothetical protein predicted by genefinder;supported by full-length cDNA: Ceres:271253.,At1g03850,,,839392,NM_100265 /// NM_179255,AT1G03850,0009735 // response to cytokinin stimulus // inferred from expression pattern /// 0045454 // cell redox homeostasis // inferred from electronic annotation,0005634 // nucleus // inferred from electronic annotation /// 0005737 // cytoplasm // inferred from electronic annotation,0009055 // electron carrier activity // inferred from electronic annotation /// 0015035 // protein disulfide oxidoreductase activity // inferred from electronic annotation /// 0046872 // metal ion binding // inferred from electronic annotation /// 0051536 // iron-sulfur cluster binding // inferred from electronic annotation /// 0051537 // 2 iron, 2 sulfur cluster binding // inferred from electronic annotation,2061.4,4576.2,44.3691549625258,3.62923178795593e-05,0.0117287095219816,-4.43588843805498
340,265204_at,At2g36650,,Arabidopsis thaliana,Jun 9, 2011,Exemplar sequence,Affymetrix Proprietary Database,hypothetical protein predicted by genscan,At2g36650,,,818237,NM_129220,AT2G36650,,,,133.45,81.025,14.0507467534812,0.000974236918678511,0.0396077093131212,-4.43881821890057
341,265221_s_at,At2g02010,,Arabidopsis thaliana,Jun 9, 2011,Exemplar sequence,Affymetrix Proprietary Database,putative glutamate decarboxylase  ; supported by cDNA: gi_13605709_gb_AF361836.1_AF361836,At2g02010,GAD3 (glutamate decarboxylase 3); calmodulin binding,GAD3,814731 /// 814732,NM_126261 /// NM_126262,AT2G02000 /// AT2G02010,0006536 // glutamate metabolic process // inferred from electronic annotation /// 0019752 // carboxylic acid metabolic process // inferred from electronic annotation,0005634 // nucleus // inferred from direct assay /// 0005829 // cytosol // inferred from direct assay,0003824 // catalytic activity // inferred from electronic annotation /// 0004351 // glutamate decarboxylase activity // inferred from electronic annotation /// 0005516 // calmodulin binding // inferred from sequence or structural similarity /// 0016829 // lyase activity // inferred from electronic annotation /// 0016831 // carboxy-lyase activity // inferred from electronic annotation /// 0030170 // pyridoxal phosphate binding // inferred from electronic annotation,-2596.35,6974.425,-34.5217438694129,7.45749144974586e-05,0.0137576909798439,-4.43610404633455
342,265245_at,At2g43060,,Arabidopsis thaliana,Jun 9, 2011,Exemplar sequence,Affymetrix Proprietary Database,unknown protein,At2g43060,,,818908,NM_129867,AT2G43060,0045449 // regulation of transcription // inferred from electronic annotation,0005634 // nucleus // inferred from electronic annotation,0003700 // sequence-specific DNA binding transcription factor activity // inferred from sequence or structural similarity /// 0030528 // transcription regulator activity // inferred from electronic annotation,2207.85,1288.175,38.9929003892347,5.25810057347871e-05,0.013061792253241,-4.43598598602796
343,265344_at,At2g22660,,Arabidopsis thaliana,Jun 9, 2011,Exemplar sequence,Affymetrix Proprietary Database,unknown protein predicted by genefinder,At2g22660,,,816797,NM_001036319 /// NM_127831,AT2G22660,,0005886 // plasma membrane // inferred from direct assay,,325.3,338.2,12.5872217725799,0.00133110193870728,0.0460333659336825,-4.43960559263305
344,265347_at,At2g22740,,Arabidopsis thaliana,Jun 9, 2011,Exemplar sequence,Affymetrix Proprietary Database,similar to mammalian MHC III region protein G9a,At2g22740,SUVH6; methyl-CpG binding / methyl-CpNpG binding / methyl-CpNpN binding / methyltransferase,SUVH6,816804,NM_179699 /// NM_201785,AT2G22740,0016568 // chromatin modification // inferred from electronic annotation /// 0016571 // histone methylation // inferred from direct assay,0000775 // chromosome, centromeric region // inferred from electronic annotation /// 0005634 // nucleus // inferred from electronic annotation,0008168 // methyltransferase activity // inferred from direct assay /// 0008168 // methyltransferase activity // inferred from electronic annotation /// 0008270 // zinc ion binding // inferred from electronic annotation /// 0008327 // methyl-CpG binding // inferred from direct assay /// 0010428 // methyl-CpNpG binding // inferred from direct assay /// 0010429 // methyl-CpNpN binding // inferred from direct assay /// 0016740 // transferase activity // inferred from electronic annotation /// 0018024 // histone-lysine N-methyltransferase activity // inferred from electronic annotation,-174.95,715.375,-23.6735803333589,0.000219846057018613,0.0209819605045797,-4.43671712239906
345,265387_at,At2g20670,,Arabidopsis thaliana,Jun 9, 2011,Exemplar sequence,Affymetrix Proprietary Database,unknown protein  ;supported by full-length cDNA: Ceres:34827.,At2g20670,,,816595,NM_127631,AT2G20670,,0009507 // chloroplast // inferred from direct assay,0005515 // protein binding // inferred from physical interaction,380.65,2534.425,21.5995931458405,0.000285794213854281,0.0227286697362099,-4.43694912640308
346,265392_at,At2g20860,,Arabidopsis thaliana,Jun 9, 2011,Exemplar sequence,Affymetrix Proprietary Database,lipoic acid synthase (LIP1)  ; supported by cDNA: gi_14334939_gb_AY035143.1_,At2g20860,LIP1 (LIPOIC ACID SYNTHASE 1); lipoic acid synthase,LIP1,816619,NM_127655,AT2G20860,0006546 // glycine catabolic process // traceable author statement /// 0008152 // metabolic process // inferred from electronic annotation /// 0009105 // lipoic acid biosynthetic process // traceable author statement /// 0009107 // lipoate biosynthetic process // inferred from electronic annotation,0005739 // mitochondrion // inferred from direct assay /// 0005739 // mitochondrion // inferred from electronic annotation /// 0005759 // mitochondrial matrix // inferred from direct assay,0003824 // catalytic activity // inferred from electronic annotation /// 0016740 // transferase activity // inferred from electronic annotation /// 0016992 // lipoate synthase activity // inferred from electronic annotation /// 0017140 // lipoic acid synthase activity // inferred from genetic interaction /// 0046872 // metal ion binding // inferred from electronic annotation /// 0051536 // iron-sulfur cluster binding // inferred from electronic annotation /// 0051539 // 4 iron, 4 sulfur cluster binding // inferred from electronic annotation,115.6,1781.65,12.4923995565546,0.00135992597410176,0.0463317452538685,-4.43966610918542
347,265395_at,At2g20850,,Arabidopsis thaliana,Jun 9, 2011,Exemplar sequence,Affymetrix Proprietary Database,putative LRR receptor protein kinase  ; supported by cDNA: gi_15810274_gb_AY056176.1_,At2g20850,SRF1 (strubbelig receptor family 1); kinase,SRF1,816618,NM_127654,AT2G20850,0006468 // protein phosphorylation // inferred from electronic annotation,0005886 // plasma membrane // inferred from direct assay /// 0016020 // membrane // inferred from electronic annotation /// 0016021 // integral to membrane // inferred from electronic annotation,0004672 // protein kinase activity // inferred from electronic annotation /// 0004872 // receptor activity // inferred from electronic annotation /// 0005515 // protein binding // inferred from electronic annotation /// 0005524 // ATP binding // inferred from electronic annotation /// 0016301 // kinase activity // inferred from sequence or structural similarity /// 0016301 // kinase activity // inferred from electronic annotation,635.05,604.125,14.8050045173353,0.000839659054575094,0.0366206941393076,-4.43849880885634
348,265424_at,At2g20780,,Arabidopsis thaliana,Jun 9, 2011,Exemplar sequence,Affymetrix Proprietary Database,putative sugar transporter,At2g20780,,,816607,NM_127643,AT2G20780,0006810 // transport // inferred from electronic annotation /// 0008643 // carbohydrate transport // inferred from electronic annotation /// 0055085 // transmembrane transport // inferred from electronic annotation,0016020 // membrane // inferred from electronic annotation /// 0016020 // membrane // inferred from sequence or structural similarity /// 0016021 // integral to membrane // inferred from electronic annotation,0005215 // transporter activity // inferred from electronic annotation /// 0005351 // sugar:hydrogen symporter activity // inferred from sequence or structural similarity /// 0015144 // carbohydrate transmembrane transporter activity // inferred from sequence or structural similarity /// 0015293 // symporter activity // inferred from electronic annotation /// 0022891 // substrate-specific transmembrane transporter activity // inferred from electronic annotation,348,719.55,12.2216757314488,0.00144697498845928,0.047268023563754,-4.43984650050957
